Liên kết,Tên công việc,Tên công ty,Mức lương,Khu vực tuyển
https://vieclam24h.vn/ban-hang-kinh-doanh/mien-trung-nhan-vien-ho-tro-thanh-toan-tai-dia-ban-c13p102id200288076.html,Miền Trung - Nhân Viên Hỗ Trợ Thanh Toán Tại Địa Bàn,Công ty Tài Chính TNHH HD SAISON,15 - 30 triệu,"Quảng Trị, Thừa Thiên Huế, Quảng Ngãi, Đà Nẵng, +4"
https://vieclam24h.vn/ban-hang-kinh-doanh/mien-dong-nhan-vien-ho-tro-thanh-toan-tai-dia-ban-c13p117id200288086.html,Miền Đông - Nhân Viên Hỗ Trợ Thanh Toán Tại Địa Bàn,Công ty Tài Chính TNHH HD SAISON,15 - 30 triệu,"Bình Phước, Bình Dương, Đắk Lắk, Tây Ninh, +5"
https://vieclam24h.vn/co-khi-o-to-tu-dong-hoa/nhan-vien-co-khi-bao-tri-sua-chua-c47p119id200288084.html,Nhân Viên Cơ Khí (Bảo Trì - Sửa Chữa),Công Ty TNHH MTV Thép Vas An Hưng Tường,11 - 13 triệu,Bình Dương
https://vieclam24h.vn/ban-hang-kinh-doanh/nhan-vien-tu-van-tai-chinh-c13p120id200287873.html,Nhân Viên Tư Vấn Tài Chính,Công Ty Tài Chính Trách Nhiệm Hữu Hạn Một Thành Viên Shinhan Việt Nam,8 - 18 triệu,Đồng Nai
https://vieclam24h.vn/det-may-da-giay-thoi-trang/tro-ly-quan-ly-san-xuat-c40p128id200284432.html,Trợ Lý Quản Lý Sản Xuất,Công Ty TNHH Đại Phát Garments,6 - 10 triệu,Đồng Tháp
https://vieclam24h.vn/det-may-da-giay-thoi-trang/cong-nhan-may-giay-c40p130id200287956.html,Công Nhân May Giày,Công Ty Tnhh Hwaseung Rạch Giá,4 - 6 triệu,Kiên Giang
https://vieclam24h.vn/ban-hang-kinh-doanh/trinh-duoc-vien-kenh-nha-thuoc-binh-phuoc-khanh-hoa-c13p117id200284267.html,Trình Dược Viên Kênh Nhà Thuốc (Bình Phước / Khánh Hòa),Công Ty Cổ Phần Tập Đoàn Merap,12 - 20 triệu,"Bình Phước, Khánh Hòa"
https://vieclam24h.vn/khach-san-nha-hang-du-lich/tro-ly-phien-dich-biet-tieng-trung-c5p119id200275311.html,Trợ Lý Phiên Dịch Biết Tiếng Trung,Công Ty TNHH Công Nghiệp Điện Quang Việt Hoa,11 - 13 triệu,Bình Dương
https://vieclam24h.vn/ke-toan/ke-toan-tong-hop-manh-quan-tri-noi-bo-c17p73id200287843.html,Kế Toán Tổng Hợp (Mạnh Quản Trị Nội Bộ),Công Ty TNHH Đầu Tư Và Phát Triển Hsd,12 - 15 triệu,Hà Nội
https://vieclam24h.vn/nong-lam-ngu-nghiep/ky-su-nuoi-trong-thuy-san-c11p120id200275485.html,Kỹ Sư Nuôi Trồng Thủy Sản,Công Ty TNHH MTV Công Nghệ Xây Dựng Môi Trường Xanh,10 - 20 triệu,Đồng Nai
https://vieclam24h.vn/ban-hang-kinh-doanh/nhan-vien-ho-tro-thanh-toan-dia-ban-dak-lak-dak-nong-c13p114id200287698.html,"Nhân Viên Hỗ Trợ Thanh Toán Địa Bàn _ Đắk Lắk, Đắk Nông",Công ty Tài Chính TNHH HD SAISON,15 - 30 triệu,"Đắk Lắk, Đắk Nông"
https://vieclam24h.vn/ban-hang-kinh-doanh/nhan-vien-ho-tro-thanh-toan-tai-dia-ban-toan-quoc-c13p129id200287702.html,Nhân Viên Hỗ Trợ Thanh Toán Tại Địa Bàn Toàn Quốc,Công ty Tài Chính TNHH HD SAISON,15 - 30 triệu,"An Giang, Sóc Trăng, Đồng Tháp, Bình Dương, +4"
https://vieclam24h.vn/ban-hang-kinh-doanh/mien-tay-nhan-vien-ho-tro-thanh-toan-tai-dia-ban-c13p123id200287704.html,Miền Tây_ Nhân Viên Hỗ Trợ Thanh Toán Tại Địa Bàn,Công ty Tài Chính TNHH HD SAISON,15 - 30 triệu,"Long An, An Giang, Cà Mau, Sóc Trăng, +3"
https://vieclam24h.vn/ban-hang-kinh-doanh/nhan-vien-ho-tro-thanh-toan-dia-ban-tai-ben-tre-c13p125id200287705.html,Nhân Viên Hỗ Trợ Thanh Toán Địa Bàn Tại Bến Tre,Công ty Tài Chính TNHH HD SAISON,15 - 25 triệu,Bến Tre
https://vieclam24h.vn/ban-hang-kinh-doanh/nhan-vien-ho-tro-thanh-toan-tai-dia-ban-binh-duong-c13p119id200287691.html,Nhân Viên Hỗ Trợ Thanh Toán Tại Địa Bàn_Bình Dương,Công ty Tài Chính TNHH HD SAISON,15 - 25 triệu,Bình Dương
https://vieclam24h.vn/ban-hang-kinh-doanh/nhan-vien-ho-tro-thanh-toan-tai-dia-ban-binh-thuan-c13p111id200287695.html,Nhân Viên Hỗ Trợ Thanh Toán Tại Địa Bàn_Bình Thuận,Công ty Tài Chính TNHH HD SAISON,15 - 25 triệu,Bình Thuận
https://vieclam24h.vn/ban-hang-kinh-doanh/nhan-vien-ho-tro-thanh-toan-tai-dia-ban-ba-ria-vung-tau-c13p121id200287696.html,Nhân Viên Hỗ Trợ Thanh Toán Tại Địa Bàn_Bà Rịa Vũng Tàu,Công ty Tài Chính TNHH HD SAISON,15 - 25 triệu,Bà Rịa - Vũng Tàu
https://vieclam24h.vn/ban-hang-kinh-doanh/nhan-vien-ho-tro-thanh-toan-tai-dia-ban-dong-nai-c13p120id200287697.html,Nhân Viên Hỗ Trợ Thanh Toán Tại Địa Bàn_Đồng Nai,Công ty Tài Chính TNHH HD SAISON,15 - 25 triệu,Đồng Nai
https://vieclam24h.vn/tai-chinh-dau-tu-chung-khoan/nhan-vien-tu-van-tin-dung-kenh-tra-gop-cao-lanh-dong-thap-c18p128id200287667.html,Nhân Viên Tư Vấn Tín Dụng - Kênh Trả Góp - Cao Lãnh (Đồng Tháp),Công ty Tài Chính TNHH HD SAISON,8 - 15 triệu,Đồng Tháp
https://vieclam24h.vn/ban-hang-kinh-doanh/nhan-vien-ho-tro-thanh-toan-tai-dia-ban-an-giang-dong-thap-c13p129id200287675.html,"Nhân Viên Hỗ Trợ Thanh Toán Tại Địa Bàn - An Giang, Đồng Tháp",Công ty Tài Chính TNHH HD SAISON,15 - 30 triệu,"An Giang, Đồng Tháp"
https://vieclam24h.vn/ban-hang-kinh-doanh/nhan-vien-ho-tro-thanh-toan-tai-dia-ban-thanh-pho-phu-quoc-kien-giang-c13p130id200287678.html,"Nhân Viên Hỗ Trợ Thanh Toán Tại Địa Bàn_ Thành Phố Phú Quốc, Kiên Giang",Công ty Tài Chính TNHH HD SAISON,15 - 30 triệu,Kiên Giang
https://vieclam24h.vn/hanh-chinh-thu-ky/nhan-vien-nghiep-vu-tieng-trung-hoac-tieng-anh-c1p119id200287759.html,Nhân Viên Nghiệp Vụ （Tiếng Trung Hoặc Tiếng Anh）,Công Ty TNHH Điện Tử Và Ngũ Kim Gem Việt Nam,9 - 12 triệu,Bình Dương
https://vieclam24h.vn/van-tai-lai-xe-giao-nhan/nhan-vien-giao-nhan-xe-may-nhan-viec-ngay-c16p122id200287569.html,Nhân Viên Giao Nhận (Xe Máy)- Nhận Việc Ngay,Công Ty TNHH Thiết Bị Tiến Thành,6.5 - 7.5 triệu,TP.HCM
https://vieclam24h.vn/khoa-hoc-ky-thuat/tho-ky-thuat-co-khi-dien-nuoc-tai-gia-lam-ha-noi-di-lam-ngay-c34p73id200286903.html,"Thợ Kỹ Thuật Cơ Khí - Điện Nước Tại Gia Lâm, Hà Nội (Đi Làm Ngay)",Công Ty TNHH Khoa Học Công Nghệ Nông Nghiệp Làng Gióng,12 - 20 triệu,Hà Nội
https://vieclam24h.vn/ban-hang-kinh-doanh/ha-noi-nhan-vien-telesales-tu-van-tai-chinh-thu-nhap-10-20tr-c13p73id200283679.html,[Hà Nội] Nhân Viên Telesales/Tư Vấn Tài Chính Thu Nhập 10 - 20Tr,Công ty Tài Chính TNHH Ngân Hàng Việt Nam Thịnh Vượng SMBC,10 - 15 triệu,Hà Nội
https://vieclam24h.vn/luat-phap-ly-tuan-thu/nhan-vien-cskh-nhac-phi-tai-519-kim-ma-c25p73id200287148.html,Nhân Viên CSKH (Nhắc Phí) Tại 519 Kim Mã),Công ty Tài Chính TNHH HD SAISON,8 - 12 triệu,Hà Nội
https://vieclam24h.vn/ngan-hang/nhan-vien-tong-dai-nhac-phi-519-kim-ma-c19p73id200287149.html,Nhân Viên Tổng Đài Nhắc Phí (519 Kim Mã),Công ty Tài Chính TNHH HD SAISON,10 - 18 triệu,Hà Nội
https://vieclam24h.vn/khach-san-nha-hang-du-lich/giam-sat-ky-thuat-bao-tri-phan-thiet-c5p111id200286631.html,Giám Sát Kỹ Thuật Bảo Trì - Phan Thiết,Công Ty Cổ Phần Tập Đoàn Đầu Tư Địa Ốc No Va,10 - 12 triệu,Bình Thuận
https://vieclam24h.vn/ban-hang-kinh-doanh/tay-ninh-nhan-vien-tu-van-tin-dung-kenh-tra-gop-c13p118id200287215.html,[Tây Ninh] Nhân Viên Tư Vấn Tín Dụng - Kênh Trả Góp,Công ty Tài Chính TNHH HD SAISON,8 - 15 triệu,Tây Ninh
https://vieclam24h.vn/van-hanh-bao-tri-bao-duong/nhan-vien-sua-khuon-bao-duong-khuon-c10p92id200287195.html,Nhân Viên Sửa Khuôn -Bảo Dưỡng Khuôn,Công Ty Cổ Phần Thương Mại Và Khuôn Mẫu Sakura Việt Nam,8 - 12 triệu,Hải Phòng
https://vieclam24h.vn/van-hanh-bao-tri-bao-duong/nhan-vien-van-hanh-may-cnc-edm-c10p92id200287194.html,Nhân Viên Vận Hành Máy CNC -Edm,Công Ty Cổ Phần Thương Mại Và Khuôn Mẫu Sakura Việt Nam,8 - 12 triệu,Hải Phòng
https://vieclam24h.vn/ban-hang-kinh-doanh/nhan-vien-kinh-doanh-nganh-dau-nhot-c13p122id200287179.html,Nhân Viên Kinh Doanh (Ngành Dầu Nhớt),Công Ty TNHH Dầu Nhờn Và Hóa Chất Tấn Lộc,7 - 10 triệu,TP.HCM
https://vieclam24h.vn/ke-toan/ke-toan-noi-bo-c17p123id200287095.html,Kế Toán Nội Bộ,Công Ty TNHH Sản Xuất Thương Mại Dịch Vụ Cơ Khí & Nhựa Hải Long,8 - 10 triệu,Long An
https://vieclam24h.vn/giao-duc-dao-tao/giang-vien-chuyen-nganh-quan-tri-nha-hang-va-dich-vu-an-uong-c32p122id200283320.html,Giảng Viên Chuyên Ngành Quản Trị Nhà Hàng Và Dịch Vụ Ăn Uống,Trường Cao Đẳng Công Thương Thành Phố Hồ Chí Minh,9 - 15 triệu,TP.HCM
https://vieclam24h.vn/giao-duc-dao-tao/giang-vien-nganh-cong-nghe-ky-thuat-co-dien-tu-c32p122id200283346.html,Giảng Viên Ngành Công Nghệ Kỹ Thuật Cơ Điện Tử,Trường Cao Đẳng Công Thương Thành Phố Hồ Chí Minh,9 - 15 triệu,TP.HCM
https://vieclam24h.vn/giao-duc-dao-tao/giang-vien-chuyen-nganh-quan-tri-khach-san-c32p122id200283330.html,Giảng Viên Chuyên Ngành Quản Trị Khách Sạn,Trường Cao Đẳng Công Thương Thành Phố Hồ Chí Minh,9 - 15 triệu,TP.HCM
https://vieclam24h.vn/giao-duc-dao-tao/giang-vien-bo-mon-khung-gam-o-to-dien-o-to-c32p122id200283355.html,Giảng Viên Bộ Môn (Khung Gầm Ô Tô / Điện Ô Tô),Trường Cao Đẳng Công Thương Thành Phố Hồ Chí Minh,9 - 15 triệu,TP.HCM
https://vieclam24h.vn/khoa-hoc-ky-thuat/ky-su-co-khi-c34p73id200282806.html,Kỹ Sư Cơ Khí,Công Ty Cổ Phần Tập Đoàn Ô Tô Hiệp Hòa,15 - 20 triệu,"Hà Nội, Hưng Yên"
https://vieclam24h.vn/thiet-ke-sang-tao-nghe-thuat/nhan-vien-thiet-ke-do-hoa-c3p122id200286736.html,Nhân Viên Thiết Kế Đồ Họa,Công Ty TNHH Sản Xuất Và Thương Mại Thái Lê,8 - 11 triệu,TP.HCM
https://vieclam24h.vn/ban-si-ban-le-quan-ly-cua-hang/nhan-vien-kinh-doanh-di-lam-ngay-c6p73id200286632.html,Nhân Viên Kinh Doanh - Đi Làm Ngay,Công Ty Tnhh Thực Phẩm Tư Nam,10 - 20 triệu,Hà Nội
https://vieclam24h.vn/hanh-chinh-thu-ky/nam-nhan-vien-hanh-chinh-quan-tri-c1p73id200284318.html,Nam - Nhân Viên Hành Chính Quản Trị,Công Ty Cổ Phần Du Lịch Kova,7 - 10 triệu,Hà Nội
https://vieclam24h.vn/ban-hang-kinh-doanh/trinh-duoc-vien-kenh-nha-thuoc-otc-nganh-duoc-pham-abbott-hai-duong-c13p91id200285153.html,Trình Dược Viên Kênh Nhà Thuốc (OTC) - Ngành Dược Phẩm Abbott - Hải Dương,Abbott Việt Nam,12 - 20 triệu,Hải Dương
https://vieclam24h.vn/van-hanh-bao-tri-bao-duong/nhan-vien-bao-tri-dien-dien-lanh-c10p103id200281184.html,Nhân Viên Bảo Trì Điện / Điện Lạnh,Công Ty TNHH Hanesbrands Việt Nam Huế,6 - 8 triệu,Thừa Thiên Huế
https://vieclam24h.vn/ban-hang-kinh-doanh/nhan-vien-kinh-doanh-lam-viec-tai-kim-thanh-hai-duong-c13p91id200274361.html,Nhân Viên Kinh Doanh Làm Việc Tại Kim Thành Hải Dương,Công Ty Cổ Phần Kinh Doanh F88,8 - 15 triệu,Hải Dương
https://vieclam24h.vn/ban-hang-kinh-doanh/trinh-duoc-vien-kenh-benh-vien-nganh-hang-duoc-pham-abbott-quang-nam-bac-giang-c13p105id200285154.html,"Trình Dược Viên Kênh Bệnh Viện - Ngành Hàng Dược Phẩm Abbott - Quảng Nam, Bắc Giang",Abbott Việt Nam,14 - 22 triệu,"Quảng Nam, Bắc Giang"
https://vieclam24h.vn/ban-hang-kinh-doanh/nhan-vien-kinh-doanh-thu-nhap-13-20-trieu-c13p73id200282110.html,Nhân Viên Kinh Doanh (Thu Nhập 13-20 Triệu),Công Ty TNHH TM Và DV Quốc Tế Thiên Thành,13 - 20 triệu,Hà Nội
https://vieclam24h.vn/nong-lam-ngu-nghiep/ky-su-nong-nghiep-c11p125id200275013.html,Kỹ Sư Nông Nghiệp,Công Ty TNHH Xây Dựng - Thương Mại - Dịch Vụ Sao Vàng Đất Việt,12 - 15 triệu,"Bến Tre, Tiền Giang, Vĩnh Long, Trà Vinh"
https://vieclam24h.vn/ban-hang-kinh-doanh/giam-doc-kinh-doanh-tai-ha-noi-c13p73id200286636.html,Giám Đốc Kinh Doanh - Tại Hà Nội,Công Ty Cổ Phần Dược Phẩm Trang Vinh,30 - 50 triệu,Hà Nội
https://vieclam24h.vn/tai-chinh-dau-tu-chung-khoan/quang-tri-nhan-vien-tu-van-tin-dung-kenh-tra-gop-c18p102id200286512.html,Quảng Trị - Nhân Viên Tư Vấn Tín Dụng (Kênh Trả Góp),Công ty Tài Chính TNHH HD SAISON,8 - 15 triệu,Quảng Trị
https://vieclam24h.vn/tai-chinh-dau-tu-chung-khoan/dong-nai-nhan-vien-tu-van-tin-dung-kenh-tra-gop-c18p120id200286513.html,Đồng Nai - Nhân Viên Tư Vấn Tín Dụng (Kênh Trả Góp),Công ty Tài Chính TNHH HD SAISON,8 - 15 triệu,Đồng Nai
https://vieclam24h.vn/tai-chinh-dau-tu-chung-khoan/quan-4-hcm-nhan-vien-tu-van-tin-dung-kenh-tra-gop-c18p122id200286493.html,"Quận 4, HCM - Nhân Viên Tư Vấn Tín Dụng (Kênh Trả Góp)",Công ty Tài Chính TNHH HD SAISON,8 - 15 triệu,TP.HCM
https://vieclam24h.vn/tai-chinh-dau-tu-chung-khoan/cu-chi-hcm-nhan-vien-tu-van-tin-dung-kenh-tra-gop-c18p122id200286495.html,"Củ Chi, HCM - Nhân Viên Tư Vấn Tín Dụng (Kênh Trả Góp)",Công ty Tài Chính TNHH HD SAISON,8 - 15 triệu,TP.HCM
https://vieclam24h.vn/tai-chinh-dau-tu-chung-khoan/quan-2-hcm-nhan-vien-tu-van-tin-dung-kenh-tra-gop-c18p122id200286498.html,"Quận 2, HCM - Nhân Viên Tư Vấn Tín Dụng (Kênh Trả Góp)",Công ty Tài Chính TNHH HD SAISON,8 - 15 triệu,TP.HCM
https://vieclam24h.vn/tai-chinh-dau-tu-chung-khoan/binh-dinh-nhan-vien-tu-van-tin-dung-kenh-tra-gop-c18p107id200286500.html,Bình Định - Nhân Viên Tư Vấn Tín Dụng (Kênh Trả Góp),Công ty Tài Chính TNHH HD SAISON,8 - 15 triệu,Bình Định
https://vieclam24h.vn/tai-chinh-dau-tu-chung-khoan/dak-lak-buon-ho-nhan-vien-tu-van-tin-dung-kenh-tra-gop-c18p114id200286503.html,"Đắk Lắk, Buôn Hồ - Nhân Viên Tư Vấn Tín Dụng (Kênh Trả Góp)",Công ty Tài Chính TNHH HD SAISON,8 - 15 triệu,Đắk Lắk
https://vieclam24h.vn/tai-chinh-dau-tu-chung-khoan/bac-giang-nhan-vien-tu-van-tin-dung-kenh-tra-gop-c18p87id200286504.html,Bắc Giang - Nhân Viên Tư Vấn Tín Dụng (Kênh Trả Góp),Công ty Tài Chính TNHH HD SAISON,8 - 15 triệu,Bắc Giang
https://vieclam24h.vn/tai-chinh-dau-tu-chung-khoan/hai-phong-nhan-vien-tu-van-tin-dung-kenh-tra-gop-c18p92id200286507.html,Hải Phòng - Nhân Viên Tư Vấn Tín Dụng (Kênh Trả Góp),Công ty Tài Chính TNHH HD SAISON,8 - 15 triệu,Hải Phòng
https://vieclam24h.vn/khach-san-nha-hang-du-lich/quan-ly-quan-ca-phe-va-co-so-luu-tru-c5p112id200286328.html,Quản Lý Quán Cà Phê Và Cơ Sở Lưu Trú,Công Ty TNHH Thương Mại Dịch Vụ Vân Hậu,20 - 25 triệu,Kon Tum
https://vieclam24h.vn/thiet-ke-sang-tao-nghe-thuat/nhan-vien-thiet-ke-cad-2d-c3p118id200286099.html,Nhân Viên Thiết Kế Cad 2D,Công Ty TNHH Phú Quang,8 - 10 triệu,Tây Ninh
https://vieclam24h.vn/y-te-cham-soc-suc-khoe/bac-si-noi-co-xuong-khop-benh-vien-quoc-te-d-n-a-c21p122id200286534.html,Bác Sĩ Nội Cơ Xương Khớp (Bệnh Viện Quốc Tế D N A),Công Ty Cổ Phần Bệnh Viện Đa Khoa Quốc Tế Dna,20 - 30 triệu,TP.HCM
https://vieclam24h.vn/hoa-hoc-hoa-sinh/nhan-vien-ky-thuat-nganh-son-go-c43p104id200286331.html,Nhân Viên Kỹ Thuật Ngành Sơn Gỗ,CÔNG TY TNHH MTV SX TM DV XNK TRUNG NGUYÊN,20 - 40 triệu,Đà Nẵng
https://vieclam24h.vn/tai-chinh-dau-tu-chung-khoan/quang-binh-dong-hoi-nhan-vien-tu-van-tin-dung-kenh-tra-gop-c18p101id200286442.html,"Quảng Bình, Đồng Hới - Nhân Viên Tư Vấn Tín Dụng (Kênh Trả Góp)",Công ty Tài Chính TNHH HD SAISON,8 - 15 triệu,Quảng Bình
https://vieclam24h.vn/tai-chinh-dau-tu-chung-khoan/quang-ngai-nhan-vien-tu-van-tin-dung-kenh-tra-gop-c18p106id200286448.html,Quảng Ngãi- Nhân Viên Tư Vấn Tín Dụng (Kênh Trả Góp),Công ty Tài Chính TNHH HD SAISON,8 - 15 triệu,Quảng Ngãi
https://vieclam24h.vn/tai-chinh-dau-tu-chung-khoan/tan-uyen-binh-duong-nhan-vien-tu-van-tin-dung-kenh-tra-gop-c18p119id200286428.html,"Tân Uyên, Bình Dương - Nhân Viên Tư Vấn Tín Dụng (Kênh Trả Góp)",Công ty Tài Chính TNHH HD SAISON,8 - 15 triệu,Bình Dương
https://vieclam24h.vn/tai-chinh-dau-tu-chung-khoan/bac-giang-nhan-vien-tu-van-tin-dung-kenh-tra-gop-c18p87id200286430.html,Bắc Giang  - Nhân Viên Tư Vấn Tín Dụng (Kênh Trả Góp),Công ty Tài Chính TNHH HD SAISON,8 - 15 triệu,Bắc Giang
https://vieclam24h.vn/tai-chinh-dau-tu-chung-khoan/bac-ninh-nhan-vien-tu-van-tin-dung-kenh-tra-gop-c18p90id200286434.html,Bắc Ninh - Nhân Viên Tư Vấn Tín Dụng (Kênh Trả Góp),Công ty Tài Chính TNHH HD SAISON,8 - 15 triệu,Bắc Ninh
https://vieclam24h.vn/tai-chinh-dau-tu-chung-khoan/tay-ninh-nhan-vien-tu-van-tin-dung-kenh-tra-gop-c18p118id200286436.html,Tây Ninh - Nhân Viên Tư Vấn Tín Dụng (Kênh Trả Góp),Công ty Tài Chính TNHH HD SAISON,8 - 15 triệu,Tây Ninh
https://vieclam24h.vn/tai-chinh-dau-tu-chung-khoan/tay-ninh-duong-minh-chau-nhan-vien-tu-van-tin-dung-kenh-tra-gop-c18p118id200286439.html,"Tây Ninh, Dương Minh Châu - Nhân Viên Tư Vấn Tín Dụng (Kênh Trả Góp)",Công ty Tài Chính TNHH HD SAISON,8 - 15 triệu,Tây Ninh
https://vieclam24h.vn/tai-chinh-dau-tu-chung-khoan/nam-dong-thua-thien-hue-nhan-vien-tu-van-tin-dung-kenh-tra-gop-c18p103id200286403.html,"Nam Đông, Thừa Thiên Huế - Nhân Viên Tư Vấn Tín Dụng (Kênh Trả Góp)",Công ty Tài Chính TNHH HD SAISON,8 - 15 triệu,Thừa Thiên Huế
https://vieclam24h.vn/tai-chinh-dau-tu-chung-khoan/nhan-vien-tu-van-tin-dung-kenh-tra-gop-tai-tam-duong-vinh-phuc-c18p89id200286414.html,Nhân Viên Tư Vấn Tín Dụng (Kênh Trả Góp) Tại Tam Dương - Vĩnh Phúc,Công ty Tài Chính TNHH HD SAISON,8 - 15 triệu,Vĩnh Phúc
https://vieclam24h.vn/lao-dong-pho-thong/tho-ky-thuat-san-xuat-lap-dat-nhom-kinh-kinh-cuong-luc-c49p73id200286412.html,Thợ Kỹ Thuật Sản Xuất Lắp Đặt Nhôm Kính-Kính Cường Lực,Công Ty TNHH Sản Xuất VÀ Thương Mại Dacoli Việt Nam,7 - 15 triệu,Hà Nội
https://vieclam24h.vn/ban-hang-kinh-doanh/nu-nhan-vien-kinh-doanh-thuc-pham-thu-nhap-tren-10-trieu-c13p73id200286192.html,Nữ Nhân Viên Kinh Doanh Thực Phẩm - Thu Nhập Trên 10 Triệu,24h Seafood - Công Ty TNHH 24h Seafood,10 - 15 triệu,Hà Nội
https://vieclam24h.vn/khoa-hoc-ky-thuat/nhan-vien-lap-rap-tu-dien-long-bien-ha-noi-c34p73id200286337.html,Nhân Viên Lắp Ráp Tủ Điện (Long Biên - Hà Nội),Công Ty TNHH Phát Triển Công Nghiệp Sao Mai,9 - 15 triệu,Hà Nội
https://vieclam24h.vn/ban-hang-kinh-doanh/nhan-vien-kinh-doanh-tai-van-phong-luong-cung-hoa-hong-khong-yeu-cau-kinh-nghiem-c13p73id200248691.html,Nhân Viên Kinh Doanh Tại Văn Phòng (Lương Cứng + % Hoa Hồng) - Không Yêu Cầu Kinh Nghiệm,Công Ty Cổ Phần Tư Vấn Và Đầu Tư Bất Động Sản Newway,10 - 15 triệu,Hà Nội
https://vieclam24h.vn/bat-dong-san/nhan-vien-kinh-doanh-bds-tai-phu-my-hung-q7-luong-co-ban-hoa-hong-c29p122id200286324.html,Nhân Viên Kinh Doanh BĐS Tại Phú Mỹ Hưng - Q7 (Lương Cơ Bản + Hoa Hồng),Công Ty Cổ Phần Bất Động Sản Đại Phát Group,5 - 100 triệu,TP.HCM
https://vieclam24h.vn/bat-dong-san/nhan-vien-tu-van-khach-hang-khong-yeu-cau-kinh-nghiem-ho-tro-dao-tao-c29p122id200286344.html,Nhân Viên Tư Vấn Khách Hàng - Không Yêu Cầu Kinh Nghiệm - Hỗ Trợ Đào Tạo,Công Ty Cổ Phần Kinh Doanh Bất Động Sản Cát Tường Land,5 - 8 triệu,TP.HCM
https://vieclam24h.vn/giao-duc-dao-tao/giang-vien-giang-day-tieng-han-c32p122id200283357.html,Giảng Viên Giảng Dạy Tiếng Hàn,Trường Cao Đẳng Công Thương Thành Phố Hồ Chí Minh,9 - 15 triệu,TP.HCM
https://vieclam24h.vn/thu-mua-kho-van-chuoi-cung-ung/tai-xe-lai-xe-nang-c14p120id200286287.html,Tài Xế Lái Xe Nâng,Công Ty Tnhh Westlake Compounds Việt Nam,6 - 8 triệu,Đồng Nai
https://vieclam24h.vn/ban-hang-kinh-doanh/nhan-vien-kinh-doanh-o-to-c13p89id200286221.html,Nhân Viên Kinh Doanh Ô Tô,Công Ty Cổ Phần Đầu Tư Vinci Việt Nam,15 - 25 triệu,"Vĩnh Phúc, Hà Nội, Phú Thọ"
https://vieclam24h.vn/tai-chinh-dau-tu-chung-khoan/nhan-vien-tu-van-tin-dung-kenh-tra-gop-cho-gao-tien-giang-c18p124id200286148.html,Nhân Viên Tư Vấn Tín Dụng - Kênh Trả Góp - Chợ Gạo (Tiền Giang),Công ty Tài Chính TNHH HD SAISON,8 - 15 triệu,Tiền Giang
https://vieclam24h.vn/bao-hiem/truong-nhom-kinh-doanh-c23p122id200286140.html,Trưởng Nhóm Kinh Doanh,Công Ty Tnhh Bảo Hiểm Hanwha Life Việt Nam,30 - 50 triệu,TP.HCM
https://vieclam24h.vn/an-ninh-bao-ve/nhan-vien-bao-ve-tai-vincom-mega-grandworld-ha-noi-vinhomes-ocean-park-3-c2p93id200286102.html,"Nhân Viên Bảo Vệ Tại Vincom Mega Grandworld Hà Nội, Vinhomes Ocean Park 3",Công Ty Cổ Phần Vincom Retail,7 - 10 triệu,"Hưng Yên, Hà Nội"
https://vieclam24h.vn/ban-hang-kinh-doanh/nhan-vien-kinh-doanh-tiec-nha-hang-quan-1-c13p122id200286157.html,Nhân Viên Kinh Doanh Tiệc Nhà Hàng (Quận 1),Công Ty TNHH Ăn Uống Pha Ánh Ráng Chiều,10 - 15 triệu,TP.HCM
https://vieclam24h.vn/ke-toan/ke-toan-tong-hop-c17p111id200286103.html,Kế Toán Tổng Hợp,Công Ty TNHH TM&DV Tư Vấn Tutru Solar,8 - 12 triệu,Bình Thuận
https://vieclam24h.vn/tai-chinh-dau-tu-chung-khoan/nhan-vien-tu-van-tin-dung-kenh-tra-gop-tp-bac-lieu-c18p134id200285961.html,Nhân Viên Tư Vấn Tín Dụng - Kênh Trả Góp - Tp Bạc Liêu,Công ty Tài Chính TNHH HD SAISON,8 - 15 triệu,Bạc Liêu
https://vieclam24h.vn/tai-chinh-dau-tu-chung-khoan/nhan-vien-tu-van-tin-dung-kenh-tra-gop-hon-dat-kien-giang-c18p130id200285960.html,Nhân Viên Tư Vấn Tín Dụng - Kênh Trả Góp - Hòn Đất - Kiên Giang,Công ty Tài Chính TNHH HD SAISON,8 - 15 triệu,Kiên Giang
https://vieclam24h.vn/tai-chinh-dau-tu-chung-khoan/nhan-vien-tu-van-tin-dung-kenh-tra-gop-van-giang-hung-yen-c18p93id200285958.html,Nhân Viên Tư Vấn Tín Dụng - Kênh Trả Góp - Văn Giang (Hưng Yên),Công ty Tài Chính TNHH HD SAISON,8 - 15 triệu,Hưng Yên
https://vieclam24h.vn/tai-chinh-dau-tu-chung-khoan/nhan-vien-tu-van-tin-dung-kenh-tra-gop-tien-giang-c18p124id200285964.html,Nhân Viên Tư Vấn Tín Dụng - Kênh Trả Góp - Tiền Giang,Công ty Tài Chính TNHH HD SAISON,8 - 15 triệu,Tiền Giang
https://vieclam24h.vn/tai-chinh-dau-tu-chung-khoan/nhan-vien-tu-van-tin-dung-kenh-tra-gop-dong-thap-c18p128id200285965.html,Nhân Viên Tư Vấn Tín Dụng - Kênh Trả Góp - Đồng Tháp,Công ty Tài Chính TNHH HD SAISON,8 - 15 triệu,Đồng Tháp
https://vieclam24h.vn/tai-chinh-dau-tu-chung-khoan/nhan-vien-tu-van-tin-dung-kenh-tra-gop-ham-tan-binh-thuan-c18p111id200285952.html,Nhân Viên Tư Vấn Tín Dụng - Kênh Trả Góp - Hàm Tân (Bình Thuận),Công ty Tài Chính TNHH HD SAISON,8 - 15 triệu,Bình Thuận
https://vieclam24h.vn/tai-chinh-dau-tu-chung-khoan/nhan-vien-tu-van-tin-dung-kenh-tra-gop-le-chan-thuy-nguyen-hai-phong-c18p92id200285957.html,"Nhân Viên Tư Vấn Tín Dụng - Kênh Trả Góp - Lê Chân, Thủy Nguyên - Hải Phòng",Công ty Tài Chính TNHH HD SAISON,8 - 15 triệu,Hải Phòng
https://vieclam24h.vn/tai-chinh-dau-tu-chung-khoan/nhan-vien-tu-van-tin-dung-kenh-tra-gop-thanh-mien-hai-duong-c18p91id200285959.html,Nhân Viên Tư Vấn Tín Dụng - Kênh Trả Góp -  Thanh Miện (Hải Dương),Công ty Tài Chính TNHH HD SAISON,8 - 15 triệu,Hải Dương
https://vieclam24h.vn/tai-chinh-dau-tu-chung-khoan/nhan-vien-tu-van-tin-dung-kenh-tra-gop-cai-lay-tien-giang-c18p124id200285963.html,Nhân Viên Tư Vấn Tín Dụng - Kênh Trả Góp - Cai Lậy (Tiền Giang),Công ty Tài Chính TNHH HD SAISON,8 - 15 triệu,Tiền Giang
https://vieclam24h.vn/tai-chinh-dau-tu-chung-khoan/nhan-vien-tu-van-tin-dung-kenh-tra-gop-thi-xa-go-cong-tien-giang-c18p124id200285962.html,Nhân Viên Tư Vấn Tín Dụng - Kênh Trả Góp - Thị Xã Gò Công (Tiền Giang),Công ty Tài Chính TNHH HD SAISON,8 - 15 triệu,Tiền Giang
https://vieclam24h.vn/ban-hang-kinh-doanh/nhan-vien-ho-tro-thanh-toan-dia-ban-tai-vinh-long-c13p127id200285828.html,Nhân Viên Hỗ Trợ Thanh Toán Địa Bàn Tại Vĩnh Long,Công ty Tài Chính TNHH HD SAISON,15 - 20 triệu,Vĩnh Long
https://vieclam24h.vn/an-ninh-bao-ve/nam-dinh-nhan-vien-ho-tro-thanh-toan-tai-dia-ban-c2p96id200285874.html,Nam Định - Nhân Viên Hỗ Trợ Thanh Toán Tại Địa Bàn,Công ty Tài Chính TNHH HD SAISON,15 - 40 triệu,Nam Định
https://vieclam24h.vn/ban-si-ban-le-quan-ly-cua-hang/hung-yen-nhan-vien-ho-tro-thanh-toan-tai-dia-ban-c6p93id200285878.html,Hưng Yên - Nhân Viên Hỗ Trợ Thanh Toán Tại Địa Bàn,Công ty Tài Chính TNHH HD SAISON,15 - 40 triệu,Hưng Yên
https://vieclam24h.vn/tai-chinh-dau-tu-chung-khoan/nhan-vien-tu-van-tin-dung-kenh-tra-gop-hau-loc-thanh-hoa-c18p98id200285956.html,Nhân Viên Tư Vấn Tín Dụng - Kênh Trả Góp - Hậu Lộc (Thanh Hóa),Công ty Tài Chính TNHH HD SAISON,8 - 15 triệu,Thanh Hóa
https://vieclam24h.vn/tai-chinh-dau-tu-chung-khoan/nhan-vien-tu-van-tin-dung-kenh-tra-gop-binh-giang-hai-duong-c18p91id200285954.html,Nhân Viên Tư Vấn Tín Dụng - Kênh Trả Góp - Bình Giang (Hải Dương),Công ty Tài Chính TNHH HD SAISON,8 - 15 triệu,Hải Dương
https://vieclam24h.vn/ban-hang-kinh-doanh/key-account-manager-kenh-mt-phu-trach-chuoi-h-b-c13p122id200285902.html,Key Account Manager (Kênh MT - Phụ Trách Chuỗi H&B),Công Ty TNHH Một Thành Viên Đỉnh Phú Thịnh,Thoả thuận ,TP.HCM
https://vieclam24h.vn/ban-hang-kinh-doanh/nhan-vien-ban-hang-nop-ho-so-nhan-viec-ngay-c13p73id200286013.html,Nhân Viên Bán Hàng Nộp Hồ Sơ Nhận Việc Ngay,Công Ty TNHH Sản Xuất Xây Dựng Thương Mại Tân Tây Á,8 - 15 triệu,Hà Nội
https://vieclam24h.vn/y-te-cham-soc-suc-khoe/dieu-duong-dung-cu-c21p122id200286005.html,Điều Dưỡng Dụng Cụ,Công Ty TNHH Bệnh Viện Đức Khang,8 - 10 triệu,TP.HCM
