Liên kết,Tên công việc,Tên công ty,Mức lương,Khu vực tuyển
https://vieclam24h.vn/ke-toan/nhan-vien-ke-toan-kho-c17p73id200285710.html,Nhân Viên Kế Toán Kho,Công Ty TNHH Xnk Và Thương Mại Việt Trung,8 - 10 triệu,Hà Nội
https://vieclam24h.vn/an-ninh-bao-ve/nhan-vien-doi-an-ninh-tu-ve-nam-tu-18-35-tuoi-c2p122id200285814.html,Nhân Viên Đội An Ninh Tự Vệ (Nam Từ 18 - 35 Tuổi),Công Ty Cổ Phần Cao Su Sài Gòn - Kymdan,13 - 15 triệu,TP.HCM
https://vieclam24h.vn/ke-toan/nhan-vien-nghiep-vu-kho-lam-tai-nha-may-kymdan-cu-chi-ha-noi-c17p122id200285841.html,"Nhân Viên Nghiệp Vụ Kho (Làm Tại Nhà Máy Kymdan Củ Chi, Hà Nội)",Công Ty Cổ Phần Cao Su Sài Gòn - Kymdan,9 - 18 triệu,"TP.HCM, Hà Nội"
https://vieclam24h.vn/xuat-nhap-khau/nhan-vien-mua-hang-xuat-nhap-khau-c15p104id200285762.html,Nhân Viên Mua Hàng - Xuất Nhập Khẩu,Công Ty TNHH Nhập Khẩu Phát Thịnh Vượng,8 - 12 triệu,Đà Nẵng
https://vieclam24h.vn/van-tai-lai-xe-giao-nhan/nhan-vien-giao-nhan-c16p104id200285766.html,Nhân Viên Giao Nhận,Công Ty TNHH Nhập Khẩu Phát Thịnh Vượng,7 - 10 triệu,Đà Nẵng
https://vieclam24h.vn/ban-hang-kinh-doanh/nhan-vien-kinh-doanh-cho-thue-mua-ban-chuyen-nhuong-can-ho-chung-cu-tai-ha-noi-c13p73id200285938.html,Nhân Viên Kinh Doanh (Cho Thuê / Mua Bán Chuyển Nhượng Căn Hộ Chung Cư Tại Hà Nội),Công Ty Cổ Phần Và Đầu Tư BĐS Techhomevn,15 - 50 triệu,Hà Nội
https://vieclam24h.vn/xuat-nhap-khau/import-export-specialist-c15p119id200285950.html,Import Export Specialist, Công Ty TNHH II-VI Việt Nam,15 - 26 triệu,Bình Dương
https://vieclam24h.vn/hanh-chinh-thu-ky/nhan-vien-ho-tro-to-thu-ky-ban-tong-giam-doc-c1p73id200285944.html,Nhân Viên Hỗ Trợ Tổ Thư Ký Ban Tổng Giám Đốc,Tổng Công Ty Sông Đà - CTCP,7.5 - 8.5 triệu,Hà Nội
https://vieclam24h.vn/tai-chinh-dau-tu-chung-khoan/nhan-vien-tu-van-tra-gop-ha-noi-c18p73id200285768.html,Nhân Viên Tư Vấn Trả Góp - Hà Nội,Công ty Tài Chính TNHH HD SAISON,8 - 15 triệu,Hà Nội
https://vieclam24h.vn/marketing/nhan-vien-digital-marketing-c12p122id200285859.html,Nhân Viên Digital Marketing,Công Ty Cổ Phần Thanh Nhân Food,15 - 30 triệu,TP.HCM
https://vieclam24h.vn/ban-si-ban-le-quan-ly-cua-hang/ke-toan-cong-no-nganh-hang-red-bull-warrior-c6p122id200285326.html,Kế Toán Công Nợ - Ngành Hàng Red Bull / Warrior,Công Ty CP Phú Trường Quốc Tế,13 - 16 triệu,TP.HCM
https://vieclam24h.vn/ban-hang-kinh-doanh/nhan-vien-content-marketing-executive-c13p122id200285811.html,Nhân Viên Content Marketing Executive,Fitfood Vietnam - Công Ty TNHH Fitfood,8 - 10 triệu,TP.HCM
https://vieclam24h.vn/xay-dung/ky-su-hien-truong-di-lam-ngay-c31p122id200285786.html,Kỹ Sư Hiện Trường - Đi Làm Ngày,Công Ty TNHH Indusvina,12 - 17 triệu,"TP.HCM, Bạc Liêu"
https://vieclam24h.vn/an-ninh-bao-ve/chuyen-vien-an-ninh-giam-sat-co-so-di-lam-ngay-c2p73id200285764.html,Chuyên Viên An Ninh Giám Sát Cơ Sở (Đi Làm Ngay),Công Ty Cổ Phần Dịch Vụ Thương Mại Tổng Hợp Wincommerce,8 - 11 triệu,"Hà Nội, Đồng Nai, Bình Dương, TP.HCM, +1"
https://vieclam24h.vn/tai-chinh-dau-tu-chung-khoan/truong-nhom-cham-soc-khach-hang-dieu-phoi-c18p122id200285646.html,Trưởng Nhóm Chăm Sóc Khách Hàng - Điều Phối,Công ty Tài Chính TNHH HD SAISON,14 - 18 triệu,TP.HCM
https://vieclam24h.vn/giao-duc-dao-tao/tro-ly-tuyen-sinh-c32p122id200285691.html,Trợ Lý Tuyển Sinh,Trường Trung Học Cơ Sở Và Trung Học Phổ Thông Phạm Ngũ Lão,7 - 10 triệu,TP.HCM
https://vieclam24h.vn/hanh-chinh-thu-ky/nhan-vien-cham-soc-khach-hang-tro-ly-kinh-doanh-tieng-trung-c1p122id200285638.html,Nhân Viên Chăm Sóc Khách Hàng & Trợ Lý Kinh Doanh (Tiếng Trung),Công Ty Cổ Phần Tư Vấn Việt Nhất,15 - 25 triệu,TP.HCM
https://vieclam24h.vn/ban-hang-kinh-doanh/nhan-vien-kinh-doanh-khong-yeu-cau-kinh-nghiem-lam-viec-quan-1-c13p122id200285635.html,Nhân Viên Kinh Doanh Không Yêu Cầu Kinh Nghiệm (Làm Việc Quận 1),Công Ty TNHH Nask,7 - 9 triệu,TP.HCM
https://vieclam24h.vn/ban-hang-kinh-doanh/binh-thanh-hcm-nhan-vien-kinh-doanh-the-tin-dung-direct-sales-ngan-hang-quoc-te-c13p122id200285492.html,[Bình Thạnh - HCM] Nhân Viên Kinh Doanh Thẻ Tín Dụng (Direct Sales) - Ngân Hàng Quốc Tế,Talentnet Corporation (Công Ty CP Kết Nối Nhân Tài),6 - 18 triệu,TP.HCM
https://vieclam24h.vn/ban-hang-kinh-doanh/nhan-vien-kinh-doanh-thi-truong-c13p73id200285606.html,Nhân Viên Kinh Doanh Thị Trường,Công Ty Cổ Phần Đầu Tư Active Việt Nam,10 - 15 triệu,Hà Nội
https://vieclam24h.vn/xay-dung/ky-su-xay-dung-di-lam-ngay-c117p73id200005929.html,Kỹ Sư Xây Dựng - Đi Làm Ngay,Công Ty TNHH Gia Phong,8 - 15 triệu,Hà Nội
https://vieclam24h.vn/ban-hang-kinh-doanh/nhan-vien-tu-van-duoc-o-phong-kham-da-lieu-tai-vung-tau-hcm-c13p121id200285550.html,Nhân Viên Tư Vấn Dược Ở Phòng Khám Da Liễu Tại Vũng Tàu - HCM,Công Ty Cổ Phần Hasaki Beauty & Clinic,12 - 20 triệu,"Bà Rịa - Vũng Tàu, TP.HCM"
https://vieclam24h.vn/giao-duc-dao-tao/nhan-vien-kinh-doanh-tu-van-du-hoc-c32p122id200285517.html,Nhân Viên Kinh Doanh Tư Vấn Du Học,Công Ty TNHH Tư Vấn Giáo Dục Và Đầu Tư Quốc Tế,10 - 40 triệu,TP.HCM
https://vieclam24h.vn/ke-toan/ke-toan-tong-hop-c17p122id200285205.html,Kế Toán Tổng Hợp,Công Ty TNHH Pt Xây Dựng Khang Gia,10 - 15 triệu,TP.HCM
https://vieclam24h.vn/xuat-nhap-khau/international-sales-executive-salary-up-to-2000-c15p119id200285463.html,International Sales Executive (Salary Up To 2000$),Công Ty TNHH Dịch Vụ Vật Tư Toàn Cầu,10 - 50 triệu,Bình Dương
https://vieclam24h.vn/ban-hang-kinh-doanh/nhan-vien-kinh-doanh-phu-nhuan-khong-yeu-cau-kinh-nghiem-c13p122id200285362.html,Nhân Viên Kinh Doanh (Phú Nhuận) - Không Yêu Cầu Kinh Nghiệm ,Công Ty Cổ Phần Thương Mại Xuất Nhập Khẩu Vnt,10 - 15 triệu,TP.HCM
https://vieclam24h.vn/quan-ly-tieu-chuan-va-chat-luong/truong-phong-qa-c28p119id200285349.html,Trưởng Phòng QA,Công Ty TNHH Acumen Houseware Industry (VN),15 - 20 triệu,Bình Dương
https://vieclam24h.vn/ban-hang-kinh-doanh/nam-nhan-vien-kinh-doanh-khong-yeu-cau-kinh-nghiem-c13p73id200285424.html,Nam Nhân Viên Kinh Doanh - Không Yêu Cầu Kinh Nghiệm,Công Ty TNHH Thương Mại Godo,10 - 30 triệu,Hà Nội
https://vieclam24h.vn/ban-si-ban-le-quan-ly-cua-hang/quan-ly-cua-hang-hoang-mai-ha-noi-c6p73id200285380.html,"Quản Lý Cửa Hàng - Hoàng Mai, Hà Nội",Công Ty TNHH Thương Mại Thuỷ Sản Thiện Nhà Tôm,10 - 12 triệu,Hà Nội
https://vieclam24h.vn/kiem-toan/ke-toan-truong-quan-7-c26p122id200285166.html,Kế Toán Trưởng (Quận 7),Công Ty TNHH Dân Và Đan,Thoả thuận ,TP.HCM
https://vieclam24h.vn/ban-hang-kinh-doanh/mien-tay-nhan-vien-tu-van-tin-dung-kenh-tra-gop-c13p135id200285210.html,Miền Tây - Nhân Viên Tư Vấn Tín Dụng (Kênh Trả Góp),Công ty Tài Chính TNHH HD SAISON,8 - 15 triệu,"Cà Mau, Tiền Giang, Sóc Trăng, An Giang, +2"
https://vieclam24h.vn/ban-hang-kinh-doanh/mien-dong-nhan-vien-tu-van-tin-dung-kenh-tra-gop-c13p119id200285225.html,Miền Đông - Nhân Viên Tư Vấn Tín Dụng (Kênh Trả Góp),Công ty Tài Chính TNHH HD SAISON,8 - 15 triệu,"Bình Dương, Đồng Nai, Tây Ninh, Lâm Đồng"
https://vieclam24h.vn/xay-dung/ky-su-thuy-loi-cau-duong-ben-tre-binh-thuan-ho-chi-minh-c31p122id200285235.html,"Kỹ Sư Thủy Lợi / Cầu Đường (Bến Tre, Bình Thuận, Hồ Chí Minh)",Công ty CP XD TM Thới Bình,12 - 16 triệu,"TP.HCM, Bến Tre, Bình Thuận"
https://vieclam24h.vn/marketing/truong-phong-marketing-tai-tp-hcm-di-lam-ngay-c12p122id200285200.html,Trưởng Phòng Marketing - Tại Tp HCM (Đi Làm Ngay),CÔNG TY TNHH PHÁT TRIỂN CÔNG NGHỆ CAO HOÀNG GIA,18 - 20 triệu,TP.HCM
https://vieclam24h.vn/cham-soc-khach-hang/concierge-nhan-vien-ho-tro-quan-2-c30p122id200285147.html,Concierge - Nhân Viên Hỗ Trợ - Quận 2,Công Ty TNHH CBRE (Việt Nam),9 - 10 triệu,TP.HCM
https://vieclam24h.vn/luat-phap-ly-tuan-thu/chuyen-vien-phap-ly-doanh-nghiep-c25p119id200283475.html,Chuyên Viên Pháp Lý Doanh Nghiệp,Công Ty Cổ Phần Lúa Vàng,15 - 20 triệu,Bình Dương
https://vieclam24h.vn/ban-si-ban-le-quan-ly-cua-hang/nhan-vien-ban-hang-tai-cua-hang-di-lam-ngay-c6p73id200285170.html,Nhân Viên Bán Hàng Tại Cửa Hàng - Đi Làm Ngay,Công Ty Tnhh Thái Tuấn Group,7 - 10 triệu,Hà Nội
https://vieclam24h.vn/hanh-chinh-thu-ky/nhan-vien-le-tan-c1p122id200284997.html,Nhân Viên Lễ Tân,BAN QUẢN TRỊ CAO ỐC PARKLAND,7 - 10 triệu,TP.HCM
https://vieclam24h.vn/co-khi-o-to-tu-dong-hoa/pho-tong-giam-doc-phu-trach-ky-thuat-luong-30-50tr-c47p73id200284990.html,Phó Tổng Giám Đốc Phụ Trách Kỹ Thuật (Lương 30 - 50Tr),Công Ty Cổ Phần Tập Đoàn Xây Lắp 1 - Petrolimex,30 - 50 triệu,Hà Nội
https://vieclam24h.vn/ban-hang-kinh-doanh/nhan-vien-ho-tro-thanh-toan-dia-ban-khu-vuc-can-tho-tien-giang-c13p131id200284791.html,"Nhân Viên Hỗ Trợ Thanh Toán Địa Bàn Khu Vực Cần Thơ, Tiền Giang",Công ty Tài Chính TNHH HD SAISON,15 - 20 triệu,"Cần Thơ, Tiền Giang"
https://vieclam24h.vn/it-phan-mem/chuyen-vien-it-helpdesk-tai-kim-ma-ha-noi-c8p73id200284584.html,"Chuyên Viên IT Helpdesk Tại Kim Mã, Hà Nội",Công ty Tài Chính TNHH HD SAISON,9 - 15 triệu,Hà Nội
https://vieclam24h.vn/it-phan-mem/lap-trinh-vien-it-phan-mem-khong-yeu-cau-kinh-nghiem-c8p73id200284875.html,Lập Trình Viên - IT Phần Mềm (Không Yêu Cầu Kinh Nghiệm),Công Ty Cổ Phần Ứng Dụng CNTT Y Tế,7 - 40 triệu,Hà Nội
https://vieclam24h.vn/luat-phap-ly-tuan-thu/nhan-vien-phap-che-di-lam-ngay-c25p73id200284829.html,Nhân Viên Pháp Chế - Đi Làm Ngay,Công Ty Cổ Phần Vnt Invest Group,10 - 15 triệu,Hà Nội
https://vieclam24h.vn/hanh-chinh-thu-ky/nhan-vien-le-tan-hanh-chinh-thu-duc-biet-tieng-anh-c1p122id200284672.html,Nhân Viên Lễ Tân Hành Chính - Thủ Đức (Biết Tiếng Anh),Công Ty Cổ Phần Đầu Tư Tập Đoàn Hanmicosmetic Global,7 - 10 triệu,TP.HCM
https://vieclam24h.vn/ban-hang-kinh-doanh/chuyen-vien-kinh-doanh-phan-phoi-san-pham-thiet-bi-mang-phu-kien-vi-tinh-thu-nhap-tu-10tr-tro-len-c13p73id200284803.html,"Chuyên Viên Kinh Doanh - Phân Phối Sản Phẩm Thiết Bị Mạng, Phụ Kiện Vi Tính,... (Thu Nhập Từ 10Tr Trở Lên)",Công Ty TNHH Điện Tử Công Nghệ Tường An - T.A.K.O,10 - 30 triệu,"Hà Nội, TP.HCM"
https://vieclam24h.vn/marketing/giam-doc-kinh-doanh-c12p104id200284764.html,Giám Đốc Kinh Doanh,Công Ty Cổ Phần Bình Vinh,Thoả thuận ,Đà Nẵng
https://vieclam24h.vn/dien-dien-tu-dien-lanh/nhan-vien-ky-thuat-thiet-bi-he-thong-dien-nhe-hcm-c41p122id200284702.html,Nhân Viên Kỹ Thuật Thiết Bị Hệ Thống Điện Nhẹ [HCM],Công Ty TNHH Tư Vấn - Thương Mại - Dịch Vụ Gia Bảo,9 - 12 triệu,TP.HCM
https://vieclam24h.vn/ban-si-ban-le-quan-ly-cua-hang/hcm-quan-ly-cua-hang-lush-vincom-dong-khoi-c6p122id200284657.html,[HCM] Quản Lý Cửa Hàng Lush Vincom Đồng Khởi,Công Ty Cổ Phần Maison Retail Management International,8.5 - 9.5 triệu,TP.HCM
https://vieclam24h.vn/ban-si-ban-le-quan-ly-cua-hang/hcm-nhan-vien-ban-hang-thoi-trang-cao-cap-c6p122id200284655.html,[HCM] Nhân Viên Bán Hàng Thời Trang Cao Cấp,Công Ty Cổ Phần Maison Retail Management International,6 - 8 triệu,TP.HCM
https://vieclam24h.vn/ban-si-ban-le-quan-ly-cua-hang/hcm-giam-sat-cua-hang-thoi-trang-cao-cap-c6p122id200284654.html,[HCM] Giám Sát Cửa Hàng Thời Trang Cao Cấp,Công Ty Cổ Phần Maison Retail Management International,8 - 10 triệu,TP.HCM
https://vieclam24h.vn/ban-si-ban-le-quan-ly-cua-hang/bien-hoa-nhan-vien-ban-hang-cua-hang-charles-keith-vincom-bien-hoa-c6p120id200284652.html,[Biên Hòa] Nhân Viên Bán Hàng Cửa Hàng Charles & Keith Vincom Biên Hòa,Công Ty Cổ Phần Maison Retail Management International,6 - 8 triệu,Đồng Nai
https://vieclam24h.vn/ban-si-ban-le-quan-ly-cua-hang/binh-duong-quan-ly-cua-hang-nhan-hang-charles-keith-aeon-mall-canary-c6p119id200284648.html,[Bình Dương] Quản Lý Cửa Hàng Nhãn Hàng Charles & Keith Aeon Mall Canary,Công Ty Cổ Phần Maison Retail Management International,10 - 12 triệu,Bình Dương
https://vieclam24h.vn/khach-san-nha-hang-du-lich/nhan-vien-ky-thuat-toa-nha-quan-1-quan-2-quan-4-c5p122id200284640.html,"Nhân Viên Kỹ Thuật Tòa Nhà  (Quận 1, Quận 2, Quận 4)",Công Ty TNHH CBRE (Việt Nam),8 - 10 triệu,TP.HCM
https://vieclam24h.vn/cham-soc-khach-hang/nhan-vien-tu-van-cham-soc-khach-hang-c30p104id200284482.html,Nhân Viên Tư Vấn / Chăm Sóc Khách Hàng,"Cat Tuong H.a.i Co.,Ltd",7 - 10 triệu,Đà Nẵng
https://vieclam24h.vn/ke-toan/ke-toan-tong-hop-di-lam-ngay-uu-tien-ung-vien-khu-vuc-gia-lam-ha-noi-c17p73id200284605.html,"Kế Toán Tổng Hợp – Đi Làm Ngay – Ưu Tiên Ứng Viên Khu Vực Gia Lâm, Hà Nội",Công Ty Cổ Phần Inox Tân Đạt,14 - 15 triệu,Hà Nội
https://vieclam24h.vn/khoa-hoc-ky-thuat/nhan-vien-bao-tri-may-c34p121id200284501.html,Nhân Viên Bảo Trì Máy,Công Ty TNHH Thực Phẩm Và Nước Giải Khát Á Châu,8 - 15 triệu,Bà Rịa - Vũng Tàu
https://vieclam24h.vn/tai-chinh-dau-tu-chung-khoan/tong-dai-vien-nhac-phi-ha-noi-c18p73id200284574.html,Tổng Đài Viên Nhắc Phí (Hà Nội),Công ty Tài Chính TNHH HD SAISON,10 - 18 triệu,Hà Nội
https://vieclam24h.vn/ban-hang-kinh-doanh/nhan-vien-ban-hang-tai-yamaha-town-do3-ho-chi-minh-c13p122id200284520.html,Nhân Viên Bán Hàng Tại Yamaha Town Do3 Hồ Chí Minh,Công Ty TNHH Yamaha Motor Việt Nam,8 - 15 triệu,TP.HCM
https://vieclam24h.vn/ban-hang-kinh-doanh/nhan-vien-kinh-doanh-c13p131id200284441.html,Nhân Viên Kinh Doanh,Công Ty TNHH Thiết Bị Y Tế Medent,7 - 8 triệu,"Cần Thơ, TP.HCM"
https://vieclam24h.vn/co-khi-o-to-tu-dong-hoa/nhan-vien-lap-trinh-gia-cong-co-khi-chinh-xac-c47p120id200284499.html,Nhân Viên Lập Trình Gia Công Cơ Khí Chính Xác,Công Ty Cổ Phần Xây Dựng Nhật Gia,10 - 15 triệu,Đồng Nai
https://vieclam24h.vn/khach-san-nha-hang-du-lich/nhan-vien-phu-bep-nam-c5p122id200284478.html,Nhân Viên Phụ Bếp Nam,Công Ty Cổ Phần City Kitchen,4 - 10 triệu,TP.HCM
https://vieclam24h.vn/marketing/nhan-vien-kinh-doanh-c12p119id200284476.html,Nhân Viên Kinh Doanh,Công Ty TNHH Sản Xuất Thịnh Việt,20 - 35 triệu,Bình Dương
https://vieclam24h.vn/tai-chinh-dau-tu-chung-khoan/chuyen-vien-tu-van-tai-chinh-ung-dung-so-tincard-c18p122id200284067.html,Chuyên Viên Tư Vấn Tài Chính (Ứng Dụng Số Tincard),Công Ty Tài Chính Cổ Phần Tín Việt - Vietcredit,12 - 30 triệu,"TP.HCM, Cần Thơ, Đà Nẵng"
https://vieclam24h.vn/quan-ly-tieu-chuan-va-chat-luong/chuyen-vien-quan-ly-chat-luong-nganh-bo-sua-vinamilk-tower-c28p122id200284374.html,Chuyên Viên Quản Lý Chất Lượng (Ngành Bò Sữa) _Vinamilk Tower,Công Ty TNHH MTV Bò Sữa Việt Nam (Vinamilk),14 - 18 triệu,TP.HCM
https://vieclam24h.vn/ban-hang-kinh-doanh/nhan-vien-mua-hang-khong-yeu-cau-kinh-nghiem-c13p73id200283956.html,Nhân Viên Mua Hàng Không Yêu Cầu Kinh Nghiệm,Công Ty TNHH Hiwin Hongkong,7 - 10 triệu,Hà Nội
https://vieclam24h.vn/giao-duc-dao-tao/chuyen-vien-giao-vu-quan-ly-hoc-vien-tai-quan-9-hcm-c32p122id200284249.html,"Chuyên Viên Giáo Vụ, Quản Lý Học Viên Tại Quận 9, HCM",Cen Land - Công Ty Cổ Phần Bất Động Sản Thế Kỷ,15 - 23 triệu,TP.HCM
https://vieclam24h.vn/khoa-hoc-ky-thuat/nhan-vien-ky-thuat-thi-cong-dien-dien-nhe-tai-hcm-c34p122id200195969.html,Nhân Viên Kỹ Thuật Thi Công Điện - Điện Nhẹ Tại HCM,Công Ty Cổ Phần Bằng Hữu Kinh Doanh,8 - 15 triệu,TP.HCM
https://vieclam24h.vn/hanh-chinh-thu-ky/cham-soc-khach-hang-di-lam-ngay-khong-yeu-cau-kn-c1p122id200284197.html,Chăm Sóc Khách Hàng (Đi Làm Ngay - Không Yêu Cầu Kn),Công Ty Cổ Phần Bất Động Sản Cona Land,8 - 10 triệu,TP.HCM
https://vieclam24h.vn/hanh-chinh-thu-ky/tro-ly-kinh-doanh-sales-admin-luong-up-10-trieu-thang-c1p122id200284213.html,Trợ Lý Kinh Doanh (Sales Admin) - Lương Up 10 Triệu / Tháng,Công Ty Cổ Phần Bất Động Sản Cona Land,8 - 10 triệu,TP.HCM
https://vieclam24h.vn/tai-chinh-dau-tu-chung-khoan/giam-doc-tai-chinh-c18p122id200284192.html,Giám Đốc Tài Chính,Công Ty Cổ Phần Tập Đoàn Quang Phúc,15 - 30 triệu,TP.HCM
https://vieclam24h.vn/hanh-chinh-thu-ky/nhan-vien-le-tan-tp-hcm-c1p122id200284183.html,Nhân Viên Lễ Tân - Tp. HCM,Công Ty TNHH CBRE (Việt Nam),10 - 11 triệu,TP.HCM
https://vieclam24h.vn/marketing/nhan-vien-marketing-excutive-luong-tu-15-20-trieu-c12p121id200284058.html,Nhân Viên Marketing Excutive (Lương Từ 15 - 20 Triệu),Công Ty Tnhh Kim Cương Xanh Bà Rịa,15 - 20 triệu,Bà Rịa - Vũng Tàu
https://vieclam24h.vn/nhan-su/pho-phong-nhan-su-c22p73id200284138.html,Phó Phòng Nhân Sự,Chi Nhánh Số 1 – Công Ty Tnhh Khuất Bình,12 - 15 triệu,Hà Nội
https://vieclam24h.vn/xay-dung/can-bo-ky-thuat-giam-sat-hien-truong-du-an-thu-nhap-15-den-22-trieu-c31p73id200283919.html,Cán Bộ Kỹ Thuật - Giám Sát Hiện Trường Dự Án (Thu Nhập 15 Đến 22 Triệu),Công ty CP đá Granite & Marble Tự Nhiên Thiên Sơn,15 - 22 triệu,Hà Nội
https://vieclam24h.vn/ke-toan/nhan-vien-ke-toan-tong-hop-c17p122id200284034.html,Nhân Viên Kế Toán Tổng Hợp,Công Ty TNHH Thương Mại Dịch Vụ Green Leaf Việt Nam,12 - 15 triệu,TP.HCM
https://vieclam24h.vn/ban-hang-kinh-doanh/chuyen-vien-kinh-doanh-khong-can-kinh-nghiem-luong-cb-14-trieu-hoa-hong-30-c13p122id200290870.html,Chuyên Viên Kinh Doanh (Không Cần Kinh Nghiệm) Lương Cb 14 Triệu + Hoa Hồng 30%.,AIA Exchange HCM,14 - 20 triệu,TP.HCM
https://vieclam24h.vn/ke-toan/ke-toan-theo-doi-don-hang-cong-trinh-tai-long-an-c17p123id200290680.html,Kế Toán Theo Dõi Đơn Hàng Công Trình Tại Long An,Công Ty Cổ Phần Gia Phú,10 - 15 triệu,Long An
https://vieclam24h.vn/khoa-hoc-ky-thuat/nhan-vien-kiem-soat-chat-luong-cuoi-line-c34p119id200287558.html,Nhân Viên Kiểm Soát Chất Lượng Cuối Line,Công Ty TNHH Camso Việt Nam,7 - 11 triệu,Bình Dương
https://vieclam24h.vn/co-khi-o-to-tu-dong-hoa/nhan-vien-van-hanh-may-lam-viec-tai-kcn-dong-nam-cu-chi-c47p122id200285696.html,Nhân Viên Vận Hành Máy Làm Việc Tại Kcn Đông Nam Củ Chi,Công Ty TNHH Bao Bì Alpla (Việt Nam),7 - 10 triệu,TP.HCM
https://vieclam24h.vn/ban-hang-kinh-doanh/nhan-vien-ban-hang-sales-admin-lam-viec-tai-van-phong-muc-luong-len-den-17tr-thang-c13p122id200285427.html,Nhân Viên Bán Hàng Sales Admin Làm Việc Tại Văn Phòng (Mức Lương Lên Đến 17Tr / Tháng),Công Ty CP Xây Dựng & Kinh Doanh Thế Giới Nhà,8 - 17 triệu,TP.HCM
https://vieclam24h.vn/ban-hang-kinh-doanh/nhan-vien-ban-hang-qua-dien-thoai-san-pham-banh-keo-tet-orion-c13p73id200286338.html,Nhân Viên Bán Hàng Qua Điện Thoại (Sản Phẩm Bánh Kẹo Tết Orion),Công Ty TNHH Thực Phẩm Orion Vina,6 - 7 triệu,Hà Nội
https://vieclam24h.vn/van-tai-lai-xe-giao-nhan/tai-xe-taxi-xanh-sm-c16p73id200287493.html,Tài Xế Taxi Xanh Sm,Công Ty Cổ Phần Di Chuyển Xanh Và Thông Minh Gsm,15 - 25 triệu,Hà Nội
https://vieclam24h.vn/khach-san-nha-hang-du-lich/to-truong-cua-hang-ga-ran-jollibee-khu-vuc-mien-bac-c5p73id200290768.html,Tổ Trưởng Cửa Hàng Gà Rán Jollibee -Khu Vực Miền Bắc,Công Ty TNHH Jollibee Việt Nam,7 - 8 triệu,"Hà Nội, Yên Bái, Bắc Ninh, Bắc Giang"
https://vieclam24h.vn/thu-mua-kho-van-chuoi-cung-ung/nhan-vien-kho-hang-c14p73id200287199.html,Nhân Viên Kho Hàng,Công Ty Cổ Phần Dịch Vụ Và Sản Xuất Phúc Tân,6 - 8 triệu,Hà Nội
https://vieclam24h.vn/ban-hang-kinh-doanh/nhan-vien-tu-van-tin-dung-tra-gop-tai-quang-ngai-kon-tum-dak-lak-c13p112id200286063.html,"Nhân Viên Tư Vấn Tín Dụng Trả Góp Tại Quảng Ngãi , Kon Tum. Đak Lak",Cty Tài Chính TNHH MTV Mirae Asset (Việt Nam),7 - 15 triệu,"Kon Tum, Quảng Ngãi, Đắk Lắk, Gia Lai"
https://vieclam24h.vn/ban-hang-kinh-doanh/nhan-vien-tu-van-tra-gop-can-tho-vinh-long-ca-mau-c13p131id200286057.html,"Nhân Viên Tư Vấn Trả Góp (Cần Thơ, Vĩnh Long, Cà Mau)",Cty Tài Chính TNHH MTV Mirae Asset (Việt Nam),7 - 10 triệu,"Cần Thơ, Vĩnh Long, Cà Mau, Hậu Giang"
https://vieclam24h.vn/cham-soc-khach-hang/tong-dai-vien-viettel-tai-tan-phu-c30p122id200283182.html,Tổng Đài Viên Viettel Tại Tân Phú,Công Ty TNHH BPO Niềm Tin Việt,8 - 12 triệu,TP.HCM
https://vieclam24h.vn/thu-mua-kho-van-chuoi-cung-ung/nhan-vien-chung-tu-hang-xuat-hang-nhap-c14p122id200287313.html,Nhân Viên Chứng Từ Hàng Xuất - Hàng Nhập,Công Ty TNHH Chasen Logistics Việt Nam,15 - 18 triệu,TP.HCM
https://vieclam24h.vn/ban-hang-kinh-doanh/nhan-vien-tu-van-tra-gop-tphcm-va-khu-vuc-dong-nam-bo-c13p117id200286061.html,Nhân Viên Tư Vấn Trả Góp - TPHCM Và Khu Vực Đông Nam Bộ,Cty Tài Chính TNHH MTV Mirae Asset (Việt Nam),7 - 15 triệu,"Bình Phước, Đắk Lắk, Bình Dương, Tây Ninh, +6"
https://vieclam24h.vn/ke-toan/ke-toan-noi-bo-thoi-vu-8-thang-c17p122id200283377.html,Kế Toán Nội Bộ Thời Vụ 8 Tháng,Công Ty TNHH Saigon Đồ Gỗ Quốc Tế,7 - 8 triệu,TP.HCM
https://vieclam24h.vn/cham-soc-khach-hang/nhan-vien-tu-van-tuyen-sinh-c30p122id200257019.html,Nhân Viên Tư Vấn Tuyển Sinh,Công Ty Cổ Phần Giáo Dục Và Năng Lượng Đông Đô,7 - 10 triệu,TP.HCM
https://vieclam24h.vn/it-phan-cung-mang/thuc-tap-sinh-it-c7p122id200287684.html,Thực Tập Sinh IT,Văn Phòng Đại Diện Hikvision Singapore Pte. Ltd. Tại Thành Phố Hồ Chí Minh,5 - 10 triệu,TP.HCM
https://vieclam24h.vn/hanh-chinh-thu-ky/nhan-vien-sale-admin-nu-c1p122id200291017.html,Nhân Viên Sale Admin (Nữ),Công Ty TNHH Xây Dựng Thương Mại Và Tư Vấn Trí Viễn,8 - 10 triệu,TP.HCM
https://vieclam24h.vn/ban-si-ban-le-quan-ly-cua-hang/nhan-vien-ban-hang-cua-hang-mat-kinh-c6p122id200290279.html,Nhân Viên Bán Hàng - Cửa Hàng Mắt Kính,Công Ty TNHH Giải Pháp Công Nghệ Truyền Thông Dgroup,6 - 8 triệu,"TP.HCM, Hà Nội"
https://vieclam24h.vn/ban-hang-kinh-doanh/chuyen-vien-tu-van-tuyen-sinh-giao-duc-anh-ngu-c13p122id200264101.html,Chuyên Viên Tư Vấn Tuyển Sinh (Giáo Dục Anh Ngữ),Chi Nhánh Công Ty Cổ Phần Eduvator,8 - 25 triệu,"TP.HCM, Hà Nội"
https://vieclam24h.vn/hanh-chinh-thu-ky/nhan-vien-to-chuc-su-kien-event-executive-nganh-duoc-pham-c1p122id200290155.html,Nhân Viên Tổ Chức Sự Kiện - Event Executive - Ngành Dược Phẩm,Abbott Việt Nam,10 - 15 triệu,TP.HCM
https://vieclam24h.vn/lao-dong-pho-thong/lao-dong-pho-thong-c49p119id200289133.html,Lao Động Phổ Thông,Công Ty Cổ Phần Sản Xuất Dịch Vụ Nghệ Thuật Việt,6 - 15 triệu,Bình Dương
https://vieclam24h.vn/ban-hang-kinh-doanh/nhan-vien-kinh-doanh-du-an-c13p73id200289718.html,Nhân Viên Kinh Doanh Dự Án,Công Ty TNHH Tập Đoàn Rita Võ,10 - 15 triệu,Hà Nội
https://vieclam24h.vn/cham-soc-khach-hang/nhan-vien-ho-tro-khach-hang-qua-dien-thoai-c30p122id200289714.html,Nhân Viên Hỗ Trợ Khách Hàng Qua Điện Thoại,Công Ty TNHH BPO Niềm Tin Việt,8 - 12 triệu,TP.HCM
https://vieclam24h.vn/cham-soc-khach-hang/nhan-vien-cham-soc-khach-hang-c30p122id200289712.html,Nhân Viên Chăm Sóc Khách Hàng,Công Ty TNHH BPO Niềm Tin Việt,8 - 12 triệu,TP.HCM
https://vieclam24h.vn/cham-soc-khach-hang/nhan-vien-truc-tong-dai-viettel-c30p122id200289711.html,Nhân Viên Trực Tổng Đài Viettel,Công Ty TNHH BPO Niềm Tin Việt,8 - 12 triệu,TP.HCM
https://vieclam24h.vn/hanh-chinh-thu-ky/nhan-vien-xu-ly-ho-so-thoi-vu-tai-hai-phong-c1p92id200289702.html,Nhân Viên Xử Lý Hồ Sơ Thời Vụ Tại Hải Phòng,Công Ty TNHH Sài Gòn BPO,7.5 - 9 triệu,Hải Phòng
https://vieclam24h.vn/ban-hang-kinh-doanh/nhan-vien-kinh-doanh-khong-yeu-cau-kinh-nghiem-di-lam-ngay-c13p73id200289099.html,Nhân Viên Kinh Doanh Không Yêu Cầu Kinh Nghiệm (Đi Làm Ngay),Công Ty TNHH Hỗ Trợ Mua Toàn Cầu,8 - 50 triệu,Hà Nội
https://vieclam24h.vn/giao-duc-dao-tao/giao-vien-ielts-tai-ha-noi-c32p73id200287869.html,Giáo Viên IELTS Tại Hà Nội,Công Ty Cổ Phần Đào Tạo Ames - Chi Nhánh Hà Nội,8.5 - 15 triệu,Hà Nội
https://vieclam24h.vn/marketing/nhan-vien-kinh-doanh-c12p122id200289209.html,Nhân Viên Kinh Doanh,Công Ty Cổ Phần Thương Mại Dịch Vụ Bds New Home,5 - 20 triệu,TP.HCM
https://vieclam24h.vn/marketing/nhan-vien-phat-trien-kinh-doanh-c12p122id200289145.html,Nhân Viên Phát Triển Kinh Doanh,Công Ty Cổ Phần Sản Xuất Đầu Tư Thương Mại Vũ Thiên,8 - 10 triệu,TP.HCM
https://vieclam24h.vn/ban-si-ban-le-quan-ly-cua-hang/quan-ly-cua-hang-c6p73id200288302.html,Quản Lý Cửa Hàng,Công Ty TNHH Thương Mại Và Đầu Tư La.Ma.Son,10 - 18 triệu,Hà Nội
https://vieclam24h.vn/ban-si-ban-le-quan-ly-cua-hang/quan-ly-quay-bar-bep-tai-quan-10-di-lam-ngay-c6p122id200288974.html,Quản Lý Quầy Bar / Bếp - Tại Quận 10 (Đi Làm Ngay),Công Ty TNHH Một Thành Viên Bigfun,9 - 12 triệu,TP.HCM
https://vieclam24h.vn/san-xuat-lap-rap-che-bien/thuc-tap-sinh-phong-r-d-thu-nhap-tu-5-trieu-lam-viec-tai-bac-ninh-co-xe-dua-don-tu-ha-noi-c9p90id200288169.html,Thực Tập Sinh Phòng R&D - Thu Nhập Từ 5 Triệu - Làm Việc Tại Bắc Ninh - Có Xe Đưa Đón Từ Hà Nội,Công Ty TNHH Ariston Industrial Việt Nam,4.9 - 5 triệu,Bắc Ninh
