Liên kết,Tên công việc,Tên công ty,Mức lương,Khu vực tuyển
https://vieclam24h.vn/ban-hang-kinh-doanh/nhan-vien-kinh-doanh-khong-yeu-cau-kinh-nghiem-c13p73id200282246.html,Nhân Viên Kinh Doanh Không Yêu Cầu Kinh Nghiệm,Công Ty TNHH Thương Mại Và Dịch Vụ Thiết Bị Phúc Lâm,6 - 15 triệu,Hà Nội
https://vieclam24h.vn/y-te-cham-soc-suc-khoe/nhan-vien-dieu-duong-khong-yeu-cau-kinh-nghiem-c21p103id200281456.html,Nhân Viên Điều Dưỡng - Không Yêu Cầu Kinh Nghiệm,Công Ty TNHH MTV Dịch Vụ Y Tế Sông Hương,8 - 10 triệu,"Thừa Thiên Huế, Đà Nẵng, Quảng Bình, Quảng Trị"
https://vieclam24h.vn/bao-hiem/chuyen-vien-hoach-dinh-tai-chinh-c23p122id200281724.html,Chuyên Viên Hoạch Định Tài Chính,Công Ty TNHH Bảo Hiểm Nhân Thọ AIA (Việt Nam),16 - 30 triệu,TP.HCM
https://vieclam24h.vn/ban-hang-kinh-doanh/ha-dong-nhan-vien-tu-van-tuyen-sinh-trung-tam-tieng-anh-c13p73id200281651.html,Hà Đông - Nhân Viên Tư Vấn Tuyển Sinh (Trung Tâm Tiếng Anh),Công Ty Cổ Phần Giáo Dục Và Đầu Tư Quốc Tế Sgroup,10 - 20 triệu,Hà Nội
https://vieclam24h.vn/khoa-hoc-ky-thuat/nhan-vien-lap-trinh-kiem-van-hanh-mct-thu-nhap-12-15tr-c34p90id200279754.html,Nhân Viên Lập Trình Kiêm Vận Hành Mct Thu Nhập 12-15Tr,Công Ty TNHH Co-Ms Vina,12 - 15 triệu,Bắc Ninh
https://vieclam24h.vn/nhan-su/chuyen-vien-tuyen-dung-dao-tao-biet-tieng-anh-c22p73id200281054.html,Chuyên Viên Tuyển Dụng Đào Tạo Biết Tiếng Anh,Công Ty Cổ Phần Thương Mại Dịch Vụ Tổng Hợp Hai Bà Trưng,12 - 15 triệu,Hà Nội
https://vieclam24h.vn/kiem-toan/truong-nhom-kiem-toan-quan-1-quan-12-c26p122id200280828.html,"Trưởng Nhóm Kiểm Toán (Quận 1, Quận 12)",Công Ty TNHH Kiểm Toán FAC,15 - 18 triệu,TP.HCM
https://vieclam24h.vn/khach-san-nha-hang-du-lich/tho-lam-banh-tai-cua-hang-trung-hoa-my-dinh-c5p73id200280266.html,"Thợ Làm Bánh Tại Cửa Hàng (Trung Hòa, Mỹ Đình)",CÔNG TY TNHH PARIS BAGUETTE VIỆT NAM,6 - 8 triệu,Hà Nội
https://vieclam24h.vn/ban-hang-kinh-doanh/nhan-vien-kinh-doanh-c13p73id200279991.html,Nhân Viên Kinh Doanh,Công Ty Cổ Phần Meritronics Việt Nam - Chi Nhánh Đồng Nai,8 - 10 triệu,Hà Nội
https://vieclam24h.vn/thu-mua-kho-van-chuoi-cung-ung/chuyen-vien-mua-sam-hop-dong-thoi-vu-c14p73id200279996.html,Chuyên Viên Mua Sắm (Hợp Đồng Thời Vụ),Công Ty Cổ Phần Kinh Doanh F88,8 - 10 triệu,Hà Nội
https://vieclam24h.vn/y-te-cham-soc-suc-khoe/y-bac-si-y-hoc-co-truyen-dong-y-c21p73id200279328.html,Y Bác Sĩ Y Học Cổ Truyền - Đông Y,Công Ty TNHH Thương Mại Và Dịch Vụ Hana-Med,6 - 10 triệu,Hà Nội
https://vieclam24h.vn/marketing/nhan-vien-marketing-c12p73id200279350.html,Nhân Viên Marketing,Hợp Tác Xã Chăn Nuôi Bình Minh,12 - 20 triệu,Hà Nội
https://vieclam24h.vn/ngan-hang/vietinbank-ha-noi-thanh-hoa-chuyen-vien-tu-van-bao-hiem-kenh-ngan-hang-vietinbank-bancassurance-c19p73id200279084.html,"Vietinbank Hà Nội, Thanh Hóa - Chuyên Viên Tư Vấn Bảo Hiểm Kênh Ngân Hàng Vietinbank (Bancassurance)",Công ty TNHH Manulife ( Việt Nam ),10 - 20 triệu,"Hà Nội, Thanh Hóa"
https://vieclam24h.vn/duoc-pham/truong-bo-phan-dang-ky-thuoc-c42p73id200279049.html,Trưởng Bộ Phận Đăng Ký Thuốc,Công Ty Cổ Phần Tập Đoàn Dược Phẩm Và Thương Mại Sohaco,25 - 35 triệu,Hà Nội
https://vieclam24h.vn/bien-phien-dich/truong-nhom-su-kien-dao-tao-biet-tieng-trung-c37p73id200278631.html,Trưởng Nhóm Sự Kiện & Đào Tạo (Biết Tiếng Trung),Công Ty TNHH Thiên Sư Việt Nam - Chi Nhánh Hà Nội,15 - 20 triệu,Hà Nội
https://vieclam24h.vn/giao-duc-dao-tao/giao-vien-tieng-anh-c32p73id200278124.html,Giáo Viên Tiếng Anh,Công Ty Cổ Phần Công Nghệ Bts,9 - 13 triệu,Hà Nội
https://vieclam24h.vn/co-khi-o-to-tu-dong-hoa/tho-sat-c47p122id200275822.html,Thợ Sắt,Công Ty TNHH Thương Mại Và Dịch Vụ Cái Mép,9 - 16 triệu,TP.HCM
https://vieclam24h.vn/ban-hang-kinh-doanh/vietinbank-ha-noi-hung-yen-quang-tri-chuyen-vien-tu-van-bao-hiem-kenh-lien-ket-ngan-hang-c13p73id200275820.html,Vietinbank Hà Nội / Hưng Yên / Quảng Trị - Chuyên Viên Tư Vấn Bảo Hiểm Kênh Liên Kết Ngân Hàng,Công ty TNHH Manulife ( Việt Nam ),10 - 20 triệu,"Hà Nội, Thái Nguyên, Lào Cai, Hưng Yên, +1"
https://vieclam24h.vn/khoa-hoc-ky-thuat/chuyen-vien-ky-thuat-mach-thu-nhap-tu-15-20-trieu-c34p73id200273980.html,Chuyên Viên Kỹ Thuật Mạch - Thu Nhập Từ 15 - 20 Triệu,Công Ty Cổ Phần Dnp Hawaco,15 - 20 triệu,Hà Nội
https://vieclam24h.vn/ban-hang-kinh-doanh/nhan-vien-kinh-doanh-quang-cao-thu-nhap-19-35-trieu-di-lam-ngay-c13p73id200284799.html,"Nhân Viên Kinh Doanh Quảng Cáo (Thu Nhập: 19 - 35 Triệu, Đi Làm Ngay)",Công Ty Cổ Phần Truyền Thông Quê Hương,19 - 35 triệu,"Hà Nội, TP.HCM"
https://vieclam24h.vn/ban-hang-kinh-doanh/nhan-vien-sale-admin-c13p122id200288029.html,Nhân Viên Sale Admin,Công Ty TNHH Thương Mại Đầu Tư Đại An Phát,10 - 15 triệu,TP.HCM
https://vieclam24h.vn/cham-soc-khach-hang/nhan-vien-cham-soc-khach-hang-c30p122id200289630.html,Nhân Viên Chăm Sóc Khách Hàng,Công Ty Tnhh Thương Mại Dịch Vụ Truyên Thông Xuân Nam,12 - 15 triệu,TP.HCM
https://vieclam24h.vn/ban-si-ban-le-quan-ly-cua-hang/quan-ly-kinh-doanh-phat-trien-thi-truong-khu-vuc-tinh-c6p122id200286444.html,Quản Lý Kinh Doanh Phát Triển Thị Trường Khu Vực Tỉnh,Công Ty Cổ Phần Sản Xuất Thương Mại Và Dịch Vụ Phúc Thịnh,20 - 35 triệu,"TP.HCM, Đà Nẵng, Cần Thơ, Gia Lai, +1"
https://vieclam24h.vn/nhan-su/nhan-vien-ke-toan-hanh-chinh-nhan-su-c22p122id200290374.html,Nhân Viên Kế Toán Hành Chính Nhân Sự,Công Ty TNHH Thương Mại Nông Sản Thực Phẩm Đồng Xanh,10 - 12 triệu,TP.HCM
https://vieclam24h.vn/van-tai-lai-xe-giao-nhan/nhan-vien-dieu-do-giao-nhan-hien-truong-c16p122id200289546.html,Nhân Viên Điều Độ / Giao Nhận Hiện Trường,Công Ty Cổ Phần Mai Diêu,13 - 15 triệu,TP.HCM
https://vieclam24h.vn/ban-hang-kinh-doanh/nhan-vien-ban-hang-thi-truong-tp-hcm-quan-4-quan-binh-thanh-c13p122id200289027.html,"Nhân Viên Bán Hàng Thị Trường Tp HCM (Quận 4, Quận Bình Thạnh)",Công Ty TNHH Nabati Việt Nam,11 - 15 triệu,TP.HCM
https://vieclam24h.vn/xay-dung/giam-sat-cong-trinh-noi-that-hcm-c31p122id200288075.html,Giám Sát Công Trình Nội Thất - HCM,Adp Architects- Công Ty Cổ Phần Nội Thất Cơ Bản,10 - 15 triệu,TP.HCM
https://vieclam24h.vn/xay-dung/ky-su-xay-dung-di-lam-ngay-c31p122id200288093.html,Kỹ Sư Xây Dựng - Đi Làm Ngay,Công Ty Cổ Phần May Hữu Nghị,15 - 20 triệu,"TP.HCM, Long An"
https://vieclam24h.vn/ke-toan/ke-toan-noi-bo-di-lam-ngay-c17p122id200288020.html,Kế Toán Nội Bộ (Đi Làm Ngay),Công Ty TNHH Xây Dựng Thương Mại Dịch Vụ Bảo Lâm,9 - 11 triệu,TP.HCM
https://vieclam24h.vn/hoa-hoc-hoa-sinh/nhan-vien-ky-thuat-hoa-c43p119id200286934.html,Nhân Viên Kỹ Thuật Hóa,Công Ty TNHH Hóa Mỹ Phẩm Quốc Tế,8 - 15 triệu,Bình Dương
https://vieclam24h.vn/kien-truc-thiet-ke-noi-ngoai-that/hoa-vien-kien-truc-c4p122id200287391.html,Hoạ Viên Kiến Trúc,Công Ty TNHH Jnp,8 - 12 triệu,TP.HCM
https://vieclam24h.vn/ke-toan/ke-toan-tong-hop-c17p122id200287371.html,Kế Toán Tổng Hợp,Công Ty TNHH Fashion Blu,12 - 25 triệu,TP.HCM
https://vieclam24h.vn/xay-dung/chi-huy-truong-cong-trinh-dan-dung-kn-5-nam-c31p122id200287347.html,Chỉ Huy Trưởng Công Trình Dân Dụng (Kn 5 Năm),Công ty TNHH  Thiết Kế XD Kiến An Vinh,15 - 20 triệu,TP.HCM
https://vieclam24h.vn/ban-hang-kinh-doanh/nhan-vien-kinh-doanh-thi-truong-cong-ty-vang-bac-da-quy-c13p73id200287247.html,"Nhân Viên Kinh Doanh, Thị Trường Công Ty Vàng Bạc Đá Quý",Công Ty Cổ Phần Tập Đoàn Vàng Bạc Đá Quý Atv,15 - 30 triệu,"Hà Nội, Bắc Ninh, Đồng Nai, Đà Nẵng, +6"
https://vieclam24h.vn/hanh-chinh-thu-ky/tro-ly-giam-doc-c1p122id200287003.html,Trợ Lý Giám Đốc,Công Ty Tnhh Sản Xuất Thương Mại Dịch Vụ Công Nghệ Phương Liên,12 - 15 triệu,TP.HCM
https://vieclam24h.vn/it-phan-cung-mang/nhan-vien-it-c7p122id200286709.html,Nhân Viên IT,Công Ty TNHH Đặng Mậu Tấn,10 - 15 triệu,TP.HCM
https://vieclam24h.vn/ke-toan/ke-toan-truong-c17p122id200286400.html,Kế Toán Trưởng,Công Ty TNHH Truyền Thông Ik Group,17 - 22 triệu,TP.HCM
https://vieclam24h.vn/hanh-chinh-thu-ky/truong-phong-hanh-chinh-nhan-su-c1p122id200285075.html,Trưởng Phòng Hành Chính Nhân Sự,Công Ty TNHH Tư Vấn Và Xây Dựng Xml,25 - 60 triệu,TP.HCM
https://vieclam24h.vn/ke-toan/truong-phong-ke-toan-c17p122id200285078.html,Trưởng Phòng Kế Toán,Công Ty TNHH Tư Vấn Và Xây Dựng Xml,25 - 60 triệu,TP.HCM
https://vieclam24h.vn/hanh-chinh-thu-ky/nhan-vien-van-phong-c1p122id200284839.html,Nhân Viên Văn Phòng,Công Ty TNHH Rau Quả Thực Phẩm Phú Hưng,8 - 10 triệu,TP.HCM
https://vieclam24h.vn/xay-dung/hoa-vien-ket-cau-c31p122id200284367.html,Họa Viên Kết Cấu,Công Ty TNHH Enspan (Việt Nam),8 - 15 triệu,TP.HCM
https://vieclam24h.vn/ban-hang-kinh-doanh/nhan-vien-kinh-doanh-kenh-sieu-thi-c13p122id200281454.html,Nhân Viên Kinh Doanh Kênh Siêu Thị,Công Ty TNHH Fujiya Việt Nam,10 - 18 triệu,TP.HCM
https://vieclam24h.vn/ke-toan/nhan-vien-ke-toan-tong-hop-c17p122id200286908.html,Nhân Viên Kế Toán Tổng Hợp,Công Ty Cổ Phần Nông Nghiệp D&t Sài Gòn,12 - 18 triệu,TP.HCM
https://vieclam24h.vn/cham-soc-khach-hang/nhan-vien-van-phong-tu-van-tai-chinh-c30p122id200284834.html,Nhân Viên Văn Phòng - Tư Vấn Tài Chính,Shinhan Vietnam Finance Company Limited,10 - 30 triệu,TP.HCM
https://vieclam24h.vn/van-hanh-bao-tri-bao-duong/nhan-vien-van-hanh-may-nha-may-cu-chi-c10p122id200285478.html,Nhân Viên Vận Hành Máy - Nhà Máy Củ Chi,Công Ty Tnhh Quốc Tế Unilever Việt Nam,9 - 11 triệu,TP.HCM
https://vieclam24h.vn/det-may-da-giay-thoi-trang/nhan-vien-theo-doi-don-hang-merchandiser-c40p119id200287034.html,Nhân Viên Theo Dõi Đơn Hàng / Merchandiser,Công Ty TNHH Pungkook Sai Gon II,8 - 15 triệu,Bình Dương
https://vieclam24h.vn/ke-toan/ke-toan-tong-hop-truong-bo-phan-c17p122id200287017.html,Kế Toán Tổng Hợp (Trưởng Bộ Phận),Công Ty TNHH TM SX Hưng Việt,12 - 20 triệu,TP.HCM
https://vieclam24h.vn/ban-hang-kinh-doanh/nhan-vien-kinh-doanh-luong-15-20-trieu-tai-binh-thanh-hcm-c13p122id200286369.html,Nhân Viên Kinh Doanh Lương 15-20 Triệu Tại Bình Thạnh - HCM,Công Ty TNHH Healthy Homes Viet Nam,15 - 20 triệu,TP.HCM
https://vieclam24h.vn/marketing/nhan-vien-tu-van-hcm-c12p122id200285602.html,Nhân Viên Tư Vấn (HCM),Công Ty TNHH Truyền Thông Và Quảng Cáo Siêu Kinh Doanh,7 - 15 triệu,TP.HCM
https://vieclam24h.vn/thu-mua-kho-van-chuoi-cung-ung/giao-nhan-vien-giao-hang-bang-o-to-c14p122id200285924.html,Giao Nhận Viên Giao Hàng Bằng Ô Tô,Tổng Công Ty Chuyển Phát Nhanh Bưu Điện - Công Ty Cổ Phần,7 - 9 triệu,TP.HCM
https://vieclam24h.vn/khach-san-nha-hang-du-lich/nhan-vien-thu-ngan-kiem-phuc-vu-lam-viec-tai-san-bay-tan-son-nhat-c5p122id200280809.html,Nhân Viên Thu Ngân Kiêm Phục Vụ (Làm Việc Tại Sân Bay Tân Sơn Nhất),Công Ty Cổ Phần Dịch Vụ Hàng Không Taseco Sài Gòn,8 - 10 triệu,TP.HCM
https://vieclam24h.vn/ban-hang-kinh-doanh/nhan-vien-kinh-doanh-thi-truong-thanh-hoa-da-nang-bac-giang-c13p98id200288174.html,Nhân Viên Kinh Doanh Thị Trường [Thanh Hóa - Đà Nẵng - Bắc Giang],Công Ty TNHH Nabati Việt Nam,10 - 12 triệu,"Thanh Hóa, Quảng Nam, Bắc Giang, Đà Nẵng, +2"
https://vieclam24h.vn/ban-hang-kinh-doanh/nhan-vien-sale-admin-nu-c13p122id200288107.html,Nhân Viên Sale Admin (Nữ),Công Ty TNHH Thương Mại Dịch Vụ Kỹ Thuật Hoàng Tiến Phát,7 - 10 triệu,TP.HCM
https://vieclam24h.vn/ke-toan/nhan-vien-ke-toan-c17p122id200288024.html,Nhân Viên Kế Toán,Công Ty TNHH Thương Mại Đầu Tư Đại An Phát,10 - 16 triệu,TP.HCM
https://vieclam24h.vn/nhan-su/nhan-vien-hanh-chinh-nhan-su-c22p73id200287921.html,Nhân Viên Hành Chính Nhân Sự,Công Ty TNHH Quốc Tế Milwee Việt Nam,8 - 10 triệu,Hà Nội
https://vieclam24h.vn/co-khi-o-to-tu-dong-hoa/ky-su-co-khi-uu-tien-moi-ra-truong-nhan-viec-ngay-c47p122id200286883.html,Kỹ Sư Cơ Khí (Ưu Tiên Mới Ra Trường - Nhận Việc Ngay),Công Ty TNHH Phạm Gia Phát Jewelry,9 - 13 triệu,TP.HCM
https://vieclam24h.vn/ke-toan/pho-24-ke-toan-kho-c17p122id200287842.html,(Phở 24) Kế Toán Kho,Công Ty TNHH Việt Thái Quốc Tế,10 - 13 triệu,TP.HCM
https://vieclam24h.vn/ke-toan/nhan-vien-ke-toan-ban-hang-nhan-viec-ngay-c17p122id200287763.html,Nhân Viên Kế Toán Bán Hàng Nhận Việc Ngay,Công Ty TNHH Xnk Thanh Phúc,8 - 12 triệu,TP.HCM
https://vieclam24h.vn/ke-toan/nhan-vien-ke-toan-c17p122id200285657.html,Nhân Viên Kế Toán,Công Ty TNHH Hebe Style,12 - 15 triệu,TP.HCM
https://vieclam24h.vn/cham-soc-khach-hang/nhan-vien-van-phong-ho-tro-va-cham-soc-khach-hang-c30p122id200286805.html,Nhân Viên Văn Phòng - Hỗ Trợ Và Chăm Sóc Khách Hàng,Công Ty TNHH PHP Group International Việt Nam,10 - 20 triệu,TP.HCM
https://vieclam24h.vn/ke-toan/nhan-vien-ke-toan-chi-nhanh-hcm-lam-viec-tai-da-nang-c17p104id200286756.html,Nhân Viên Kế Toán Chi Nhánh HCM - Làm Việc Tại Đà Nẵng,Công Ty TNHH Quốc Tế Mavi,11 - 12 triệu,Đà Nẵng
https://vieclam24h.vn/ban-si-ban-le-quan-ly-cua-hang/nhan-vien-quay-thuc-pham-tuoi-song-che-bien-san-banh-mi-c6p122id200285910.html,"Nhân Viên Quầy Thực Phẩm (Tươi Sống, Chế Biến Sẵn, Bánh Mì)",Công Ty TNHH Aeon Việt Nam,6 - 6.2 triệu,TP.HCM
https://vieclam24h.vn/cham-soc-khach-hang/nhan-vien-tu-van-c30p122id200285104.html,Nhân Viên Tư Vấn,Eastern Digital,10 - 15 triệu,"TP.HCM, Đồng Nai, Bình Dương, Sóc Trăng, +1"
https://vieclam24h.vn/khoa-hoc-ky-thuat/nhan-vien-ky-thuat-camera-may-tinh-may-in-va-thiet-bi-van-phong-c34p122id200284844.html,"Nhân Viên Kỹ Thuật Camera, Máy Tính, Máy In Và  Thiết Bị Văn Phòng",Công Ty Cổ Phần Viễn Thông Sài Gòn New,9 - 12 triệu,TP.HCM
https://vieclam24h.vn/it-phan-cung-mang/nhan-vien-ky-thuat-cong-nghe-thong-tin-c7p122id200284795.html,Nhân Viên Kỹ Thuật Công Nghệ Thông Tin,Công Ty Tnhh Thương Mại Dịch Vụ Saigonlab,10 - 12 triệu,TP.HCM
https://vieclam24h.vn/ban-si-ban-le-quan-ly-cua-hang/hcm-nhan-vien-ban-hang-kenh-si-hop-dong-8-thang-c6p122id200284276.html,[HCM] Nhân Viên Bán Hàng Kênh Sỉ (Hợp Đồng 8 Tháng),Công Ty TNHH Nước Giải Khát Coca-Cola Việt Nam,5 - 6.5 triệu,TP.HCM
https://vieclam24h.vn/xay-dung/chi-huy-pho-di-cong-trinh-duoc-c31p92id200284627.html,Chỉ Huy Phó (Đi Công Trình Được),Công Ty Cổ Phần Xây Dựng Vijako Việt Nam,20 - 25 triệu,"Hải Phòng, Hà Nội, Quảng Ninh"
https://vieclam24h.vn/lao-dong-pho-thong/lao-dong-pho-thong-c49p122id200284541.html,Lao Động Phổ Thông,Công Ty TNHH MTV SX TM Xnk Thắng Lợi,5 - 12 triệu,TP.HCM
https://vieclam24h.vn/y-te-cham-soc-suc-khoe/nhan-vien-y-te-kiem-nhiem-nhan-su-hse-lam-tai-hoc-mon-c21p122id200284224.html,Nhân Viên Y Tế Kiêm Nhiệm Nhân Sự & HSE (Làm Tại Hóc Môn),Công Ty TNHH Viking Việt Nam,10 - 12 triệu,TP.HCM
https://vieclam24h.vn/nhan-su/chuyen-vien-tuyen-dung-luong-10-trieu-tro-len-c22p73id200284060.html,Chuyên Viên Tuyển Dụng Lương 10 Triệu Trở Lên,Công Ty Tnhh Ip Kidizen,10 - 12 triệu,Hà Nội
https://vieclam24h.vn/luat-phap-ly-tuan-thu/chuyen-vien-kiem-soat-noi-bo-c25p122id200284019.html,Chuyên Viên Kiểm Soát Nội Bộ,Công Ty Cổ Phần Kinh Doanh F88,10 - 15 triệu,"TP.HCM, Hà Nội"
https://vieclam24h.vn/ban-hang-kinh-doanh/nam-nhan-vien-kinh-doanh-thu-nhap-tu-10-15-trieu-c13p122id200283907.html,Nam Nhân Viên Kinh Doanh - Thu Nhập Từ 10-15 Triệu,Công Ty TNHH Thương Mại Dịch Vụ Tư Vấn Đầu Tư Hoàn Kim,10 - 18 triệu,"TP.HCM, Thừa Thiên Huế, Hà Nội"
https://vieclam24h.vn/hanh-chinh-thu-ky/nhan-vien-ho-so-thau-thiet-bi-y-te-c1p122id200283966.html,Nhân Viên Hồ Sơ Thầu Thiết Bị Y Tế,Asia Bone Curve Company Limited,7 - 10 triệu,TP.HCM
https://vieclam24h.vn/ban-hang-kinh-doanh/nhan-vien-truc-tong-dai-cham-soc-khach-hang-c13p122id200283843.html,Nhân Viên Trực Tổng Đài - Chăm Sóc Khách Hàng,Công Ty TNHH Quảng Cáo Chi Phó Bảo,8 - 10 triệu,TP.HCM
https://vieclam24h.vn/ban-hang-kinh-doanh/nhan-vien-kinh-doanh-khong-yeu-cau-kinh-nghiem-co-dao-tao-c13p73id200283535.html,Nhân Viên Kinh Doanh Không Yêu Cầu Kinh Nghiệm (Có Đào Tạo),Công Ty Cổ Phần Công Nghệ Chống Giả Việt Nam,7.5 - 50 triệu,"Hà Nội, TP.HCM"
https://vieclam24h.vn/ban-hang-kinh-doanh/nhan-vien-kinh-doanh-c13p122id200282999.html,Nhân Viên Kinh Doanh,Công Ty Cổ Phần Thiết Bị Điện Tử Hafelehome Việt Nam,20 - 30 triệu,TP.HCM
https://vieclam24h.vn/hanh-chinh-thu-ky/nhan-vien-hoc-vu-giao-vu-nv-van-phong-c1p122id200282944.html,Nhân Viên Học Vụ - Giáo Vụ (NV Văn Phòng),Trung Tâm Đào Tạo Học Sinh Giỏi Khôi Nguyên,6 - 9 triệu,TP.HCM
https://vieclam24h.vn/ban-hang-kinh-doanh/nhan-vien-kinh-doanh-thi-truong-kenh-tap-hoa-gt-sale-c13p122id200281455.html,Nhân Viên Kinh Doanh Thị Trường Kênh Tạp Hóa (GT Sale),Công Ty TNHH Fujiya Việt Nam,11 - 14 triệu,TP.HCM
https://vieclam24h.vn/ban-si-ban-le-quan-ly-cua-hang/nhan-vien-kinh-doanh-may-moc-thiet-bi-c6p122id200283640.html,Nhân Viên Kinh Doanh (Máy Móc / Thiết Bị),Công Ty TNHH Anh Tin,10 - 20 triệu,TP.HCM
https://vieclam24h.vn/ban-hang-kinh-doanh/nhan-vien-kinh-doanh-may-nen-khi-thiet-bi-cong-nghiep-hcm-can-tho-c13p122id200290221.html,"Nhân Viên Kinh Doanh Máy Nén Khí - Thiết Bị Công Nghiệp (HCM, Cần Thơ)",Công Ty Cổ Phần Giải Pháp Kỹ Thuật Nam Việt,7 - 16 triệu,"TP.HCM, Cần Thơ"
https://vieclam24h.vn/ke-toan/ke-toan-cong-no-c17p122id200290000.html,Kế Toán Công Nợ,Công Ty TNHH Một Thành Viên Xây Dựng Thương Mại Gia Khang,9 - 12 triệu,TP.HCM
https://vieclam24h.vn/san-xuat-lap-rap-che-bien/production-planner-nv-ke-hoach-san-xuat-c9p119id200289939.html,Production Planner (NV Kế Hoạch Sản Xuất),Công Ty TNHH Thiết Bị Dầu Khí Schoeller Bleckmann Việt Nam,10 - 15 triệu,Bình Dương
https://vieclam24h.vn/xay-dung/nhan-vien-du-toan-xay-dung-lam-viec-tai-ha-noi-c31p73id200289760.html,Nhân Viên Dự Toán Xây Dựng Làm Việc Tại Hà Nội,Công Ty Cổ Phần Đầu Tư Phát Triển Đô Thị An Phúc Hưng,13 - 16 triệu,Hà Nội
https://vieclam24h.vn/khoa-hoc-ky-thuat/nhan-vien-ky-thuat-sua-may-tinh-kinh-nghiem-1-nam-tro-len-c34p122id200288515.html,Nhân Viên Kỹ Thuật Sửa Máy Tính - Kinh Nghiệm 1 Năm Trở Lên,Công Ty TNHH Phát Triển Công Nghệ Trường Thịnh Group,15 - 20 triệu,TP.HCM
https://vieclam24h.vn/co-khi-o-to-tu-dong-hoa/nhan-vien-ky-thuat-cong-nghe-co-dien-nhan-viec-ngay-c47p122id200288119.html,Nhân Viên Kỹ Thuật Công Nghệ Cơ Điện (Nhận Việc Ngay),Công Ty Cổ Phần May Hữu Nghị,10 - 15 triệu,TP.HCM
https://vieclam24h.vn/ban-hang-kinh-doanh/nhan-vien-sale-online-my-pham-luong-toi-20-trieu-long-bien-c13p73id200285340.html,Nhân Viên Sale Online Mỹ Phẩm ( Lương Tới 20 Triệu - Long Biên ),Công Ty TNHH Gishi Việt Nam,8 - 20 triệu,Hà Nội
https://vieclam24h.vn/co-khi-o-to-tu-dong-hoa/nhan-vien-ky-thuat-co-khi-tien-cnc-c47p73id200282825.html,Nhân Viên Kỹ Thuật Cơ Khí Tiện CNC,Công Ty CP Cơ Khí Chính Xác Việt Nhật,8 - 12 triệu,Hà Nội
https://vieclam24h.vn/tai-chinh-dau-tu-chung-khoan/chuyen-vien-nhan-vien-thu-hoi-no-dia-ban-c18p123id200281568.html,Chuyên Viên / Nhân Viên Thu Hồi Nợ Địa Bàn,SHBFinance - Công Ty Tài Chính TNHH Ngân Hàng TMCP Sài Gòn - Hà Nội,10 - 15 triệu,"Long An, An Giang, Bến Tre, Bạc Liêu, +3"
https://vieclam24h.vn/cham-soc-khach-hang/nhan-vien-telesales-lam-viec-tai-quan-10-c30p122id200289749.html,Nhân Viên Telesales Làm Việc Tại Quận 10,Chi Nhánh MobiFone Service Tp. HCM - Công Ty Cổ Phần Dịch Vụ Kỹ Thuật MobiFone,7 - 10 triệu,TP.HCM
https://vieclam24h.vn/hanh-chinh-thu-ky/nhan-vien-hanh-chinh-van-phong-c1p73id200287261.html,Nhân Viên Hành Chính Văn Phòng,Công Ty TNHH Bhb Nam Việt,7 - 15 triệu,Hà Nội
https://vieclam24h.vn/khoa-hoc-ky-thuat/nhan-vien-van-hanh-may-tap-doan-phap-c34p119id200286506.html,Nhân Viên Vận Hành Máy [Tập Đoàn Pháp],Công Ty TNHH Camso Việt Nam,7 - 10 triệu,Bình Dương
https://vieclam24h.vn/y-te-cham-soc-suc-khoe/nhan-vien-y-te-thu-nhap-10-12-trieu-c21p122id200284182.html,Nhân Viên Y Tế Thu Nhập 10-12 Triệu,Công Ty Cổ Phần Thực Phẩm Agrex Saigon,10 - 12 triệu,TP.HCM
https://vieclam24h.vn/xay-dung/nhan-vien-ky-thuat-hien-truong-luong-15-18-trieu-phong-van-di-lam-ngay-c31p73id200288319.html,Nhân Viên Kỹ Thuật Hiện Trường (Lương 15 - 18 Triệu) - Phỏng Vấn Đi Làm Ngay,Công Ty CP Đầu Tư Xây Dựng Và Thương Mại Đạt Phát,15 - 18 triệu,Hà Nội
https://vieclam24h.vn/ke-toan/nhan-vien-ke-toan-tong-hop-go-vap-phu-nhuan-c17p122id200290347.html,"Nhân Viên Kế Toán Tổng Hợp - Gò Vấp, Phú Nhuận",Công Ty TNHH Nội Thất Bếp Hồng,8 - 15 triệu,TP.HCM
https://vieclam24h.vn/y-te-cham-soc-suc-khoe/dieu-duong-phong-mo-c21p73id200290568.html,Điều Dưỡng Phòng Mổ,Bệnh Viện Đa Khoa Quốc Tế Bắc Hà - Chi Nhánh Công Ty TNHH Minh Hưng,7 - 15 triệu,Hà Nội
https://vieclam24h.vn/ban-hang-kinh-doanh/nhan-vien-kinh-doanh-c13p73id200287955.html,Nhân Viên Kinh Doanh,Công Ty Cổ Phần Xây Dựng & Công Nghệ Png,8 - 20 triệu,Hà Nội
https://vieclam24h.vn/cham-soc-khach-hang/nhan-vien-cham-soc-khach-hang-c30p122id200291001.html,Nhân Viên Chăm Sóc Khách Hàng,Công Ty Cổ Phần Vpharm,5 - 10 triệu,TP.HCM
https://vieclam24h.vn/san-xuat-lap-rap-che-bien/pho-giam-doc-nha-may-san-xuat-c9p119id200290911.html,Phó Giám Đốc Nhà Máy Sản Xuất,Công Ty TNHH MTV Sơn Hà SSP Việt Nam,30 - 40 triệu,Bình Dương
https://vieclam24h.vn/van-hanh-bao-tri-bao-duong/nhan-vien-ky-thuat-van-hanh-may-xop-hoi-c10p73id200289480.html,Nhân Viên Kỹ Thuật Vận Hành Máy Xốp Hơi,Công Ty Cổ Phần Hunafoam Việt Nam,7 - 15 triệu,Hà Nội
https://vieclam24h.vn/ban-hang-kinh-doanh/nhan-vien-kinh-doanh-phat-trien-thi-truong-c13p122id200290272.html,Nhân Viên Kinh Doanh (Phát Triển Thị Trường),Công Ty TNHH Nước Uống Tinh Khiết Sài Gòn,10 - 15 triệu,TP.HCM
https://vieclam24h.vn/ban-hang-kinh-doanh/nhan-vien-telesale-c13p122id200289895.html,Nhân Viên Telesale,Công Ty TNHH Đồng Salon,15 - 30 triệu,TP.HCM
https://vieclam24h.vn/khach-san-nha-hang-du-lich/quan-ly-cua-hang-highlands-coffee-c5p122id200291182.html,Quản Lý Cửa Hàng Highlands Coffee,Highlands Coffee Service Jsc (Công Ty Cổ Phần Dịch Vụ Cà Phê Cao Nguyên),9 - 12 triệu,"TP.HCM, Bình Dương, Bình Thuận, Bình Phước"
https://vieclam24h.vn/hanh-chinh-thu-ky/nhan-vien-phan-tich-du-lieu-kinh-doanh-c1p122id200285467.html,Nhân Viên Phân Tích Dữ Liệu Kinh Doanh,Công Ty Cổ Phần Hóa Dầu Mekong,8 - 10 triệu,TP.HCM
https://vieclam24h.vn/san-xuat-lap-rap-che-bien/truong-phong-qa-c9p93id200290137.html,Trưởng Phòng QA,Công Ty TNHH Công Nghiệp Sao Đỏ Việt Nam,Thoả thuận ,Hưng Yên
https://vieclam24h.vn/ban-hang-kinh-doanh/ha-noi-hcm-nhan-vien-ban-hang-tieu-dung-kenh-mt-gt-c13p73id200290031.html,"[Hà Nội, HCM] Nhân Viên Bán Hàng Tiêu Dùng - Kênh Mt / GT",Công Ty TNHH Phân Phối Tiên Tiến,8 - 12 triệu,"Hà Nội, TP.HCM, Bình Dương"
https://vieclam24h.vn/luat-phap-ly-tuan-thu/nhan-vien-phap-ly-c25p90id200286864.html,Nhân Viên Pháp Lý,Công Ty TNHH Tuệ Minh Law Và Cộng Sự,6 - 15 triệu,Bắc Ninh
https://vieclam24h.vn/nong-lam-ngu-nghiep/nhan-vien-nghien-cuu-phat-trien-quy-trinh-san-xuat-tom-giong-mien-trung-va-mien-bac-c11p107id200288324.html,Nhân Viên Nghiên Cứu Phát Triển Quy Trình Sản Xuất Tôm Giống Miền Trung Và Miền Bắc,Công Ty Cổ Phần Thủy Sản Việt Úc,9 - 10 triệu,Bình Định
https://vieclam24h.vn/giao-duc-dao-tao/pho-phong-phat-trien-noi-dung-toan-cap-2-c32p73id200287525.html,Phó Phòng Phát Triển Nội Dung Toán Cấp 2,Công Ty TNHH Mathexpress,13 - 14 triệu,Hà Nội
https://vieclam24h.vn/cham-soc-khach-hang/nhan-vien-tu-van-tai-chinh-luong-tren-13tr-thang-c30p122id200290245.html,Nhân Viên Tư Vấn Tài Chính - Lương Trên 13Tr / Tháng,Công Ty Tài Chính TNHH Ngân Hàng Việt Nam Thịnh Vượng SMBC (Fecredit),13 - 30 triệu,TP.HCM
https://vieclam24h.vn/nhan-su/chuyen-vien-tuyen-dung-c22p119id200290919.html,Chuyên Viên Tuyển Dụng,Công Ty TNHH MTV Sơn Hà SSP Việt Nam,10 - 15 triệu,Bình Dương
https://vieclam24h.vn/y-te-cham-soc-suc-khoe/ky-thuat-vien-gay-me-c21p122id200288513.html,Kỹ Thuật Viên Gây Mê,Công Ty Trách Nhiệm Hữu Hạn Y Tế Viễn Đông Việt Nam,16 - 20 triệu,TP.HCM
https://vieclam24h.vn/ban-hang-kinh-doanh/ho-chi-minh-nhan-vien-tu-van-the-hoi-vien-sales-consultant-c13p122id200274522.html,[Hồ Chí Minh] Nhân Viên Tư Vấn Thẻ Hội Viên / Sales Consultant,California Fitness And Yoga Centers,8 - 30 triệu,TP.HCM
https://vieclam24h.vn/ke-toan/nhan-vien-ke-toan-tong-hop-nhan-viec-ngay-c17p122id200291004.html,Nhân Viên Kế Toán Tổng Hợp (Nhận Việc Ngay),Công Ty TNHH Xây Dựng Trường Xuân,10 - 17 triệu,TP.HCM
